,date,tweet,nlikes,Candidate,Subjectivity,Polarity,Analysis
1,2022-12-20 13:01:34,to let partly furnished bedroom flat in serene amp secure neighborhood okupe estatemaryland  mper annum,0,Peter Obi,0.3625,0.1875,positive
2,2022-12-20 13:01:00,confirm nightmare may the almighty god continue to guide him amp all obidients aso rock is our destination amp well get there by his grace,0,Peter Obi,0.0,0.0,neutral
3,2022-12-20 13:00:16,po and lp are suddenly corrupt because okupe received cash and sinned for the pdp talk your mind bro closet pdapc people like you probably still plenty dey answer obidients,0,Peter Obi,1.0,-0.5,negative
4,2022-12-20 13:00:09,thanks so much for your useless rant and submissions noatter what you say we obidients will rather waste our vote than vote either of the two leprous partyapcamppdp,0,Peter Obi,0.15000000000000002,-0.075,negative
5,2022-12-20 12:59:27,gather here lets laugh at obidients,0,Peter Obi,0.1,0.3,positive
6,2022-12-20 12:58:47,obidients are beautiful,0,Peter Obi,1.0,0.85,positive
7,2022-12-20 12:58:04,akwa ibom  have turned the thing to  ooooo,1,Peter Obi,0.0,0.0,neutral
8,2022-12-20 12:57:59,that means we have a lot of obidients in apc and pdp,0,Peter Obi,0.0,0.0,neutral
9,2022-12-20 12:57:36,is peter obi th chairman of the party if no why do you suggest if obidients are going to hold him to high standards if he actually doesnt anything to do with okupe sins from his pdp days  bola tinubu has alot of dents on his image has he been removed from the campaign,0,Peter Obi,0.31999999999999995,0.08,positive
10,2022-12-20 12:57:02,look at them obidients movement is an organic movement to rescue nigeria from the recyclable politicians anyone that talks to any obidients members will definitely collect this one has started denying his dm message because his identity has been revealed,0,Peter Obi,0.5,0.0,neutral
11,2022-12-20 12:56:26,they should try mad pass mad,1,Peter Obi,1.0,-0.625,negative
12,2022-12-20 12:55:47,the obidients are solidly behind him and the labour party tinubu and his criminal gangs who are riddled with so much criminality are throwing stones using stooges the lp will win this election by god grace,0,Peter Obi,0.4625,0.04999999999999999,positive
13,2022-12-20 12:55:43,go to unity park udo udoma there are so many eligible obidients there this moment,0,Peter Obi,0.5,0.5,positive
14,2022-12-20 12:55:27,in case youre new to our campaign vote lp  vote wisely thank you,0,Peter Obi,0.6772727272727272,0.41818181818181815,positive
15,2022-12-20 12:55:08,the only ones doing any killings are fulani terrorist herdsmen nigeria terrorist security agencies amp obidients who are using blackmail to silence those who speak up your propaganda is stale amp only fools are buying it i am on ground in imo state amp the people know the enemy,0,Peter Obi,0.65,-0.15,negative
16,2022-12-20 12:55:06,let say he wins and his usual gaffe becomes widely known who would be mocked  u think his post was about obidients something that is clear for the international audience to see,0,Peter Obi,0.24666666666666667,0.01,positive
17,2022-12-20 12:54:39,still on decoration  we are in akwa ibom live     are everywhere,1,Peter Obi,0.5,0.13636363636363635,positive
18,2022-12-20 12:54:25,just a simple question youre shouting up and down  did you or did you not defraud people on this app a yes or no would have solved all this your ranting and abusing  na wa ooooo go join obidients o,0,Peter Obi,0.32301587301587303,-0.07777777777777779,negative
19,2022-12-20 12:53:15,make i see d thief wey go steal am,3,Peter Obi,0.0,0.0,neutral
20,2022-12-20 12:52:28,yep my baby maseratiii,0,Peter Obi,0.0,0.0,neutral
21,2022-12-20 12:52:12,not necessary at all no other person has been convicted as a result of  not even the main actor  if we allow ur advice they can as well persecute and convict more  to tarnish their image and prevent them from public office,0,Peter Obi,0.45499999999999996,0.14583333333333331,positive
22,2022-12-20 12:52:03,there is nothing to test herewe are obidients not okupients,0,Peter Obi,0.0,0.0,neutral
23,2022-12-20 12:51:51,lol try steal see na,0,Peter Obi,0.7,0.8,positive
24,2022-12-20 12:50:15,but his supporters are to blind to understand sha we obidients know wat to do,0,Peter Obi,0.6666666666666666,-0.5,negative
25,2022-12-20 12:49:49,all road leads to port harcourt on thursday nd december,1,Peter Obi,0.0,0.0,neutral
26,2022-12-20 12:49:36,are you okay  obidients and pa tinubu which side is more civil and cultured,0,Peter Obi,0.5,0.5,positive
27,2022-12-20 12:49:17,obidients has to  be the most naive and gullible people on earthanyways we will teach you how it is done after your shameful luleing in the general electionclasses will be available for the willing ones,10,Peter Obi,0.63,0.18,positive
28,2022-12-20 12:46:11,am obidients but my concern is the rate at apc people are buy voters cards,0,Peter Obi,0.0,0.0,neutral
29,2022-12-20 12:46:06,thought akwa ibom people are mostly obidients,0,Peter Obi,0.5,0.5,positive
30,2022-12-20 12:44:48,for the fact that  has been convicted by  government for a crime committed as a member of  i hereby withdraw the remaining money in my account to buy food so i can have more energy to argue this with pdapc toothless dogs,3,Peter Obi,0.5,0.5,positive
31,2022-12-20 12:44:46,obidients is this not beautiful  uyo is doing it for he peter obi,1,Peter Obi,1.0,-0.425,negative
32,2022-12-20 12:42:53,ibom obidientsuna too much,3,Peter Obi,0.2,0.2,positive
33,2022-12-20 12:41:31,hes fully obidients hes just been sarcastic,0,Peter Obi,0.8,0.1,positive
34,2022-12-20 12:40:29,suffer no fit us thats why were obidients it fits agbado merchants thats why theyre blind bats   go and collect your pvc for obi if suffer no fit you,0,Peter Obi,0.48888888888888893,-0.3,negative
35,2022-12-20 12:40:00,this is what both other candidates can never do or those they should welcome to themselves to come close to them  it a pity and pathetic but we have now seen the light which    i am  obidient  obidients in akwa ibom,17,Peter Obi,0.635,-0.004999999999999982,negative
36,2022-12-20 12:37:53,dear obidients thanks for getting your pvc display your pvc and cover all sensitive information n each to two people,8,Peter Obi,0.55,0.15000000000000002,positive
37,2022-12-20 12:37:35,of course im just trying to explain to him your point some obidients think they are morr obidient than others and contrary points cant be raised   it very funny this is bad optics shouldnt happen again psquare shouldnt even have been added to the poster,2,Peter Obi,0.8333333333333333,-0.18749999999999992,negative
38,2022-12-20 12:37:29,have this oppressors called apc government release our campaign jet abi we obidients should force them to do so they cant keep bullying us o make we show them x pepper wey them show jonathan in,0,Peter Obi,0.0,0.0,neutral
39,2022-12-20 12:37:10,facts tinubu is a convicted drug lord according to the usa  oya excuse explain lie misdirect cry insult obidients pretend dig ignore center your criticisms on doyin yet bat remains what he is a plea bargained drug offender,0,Peter Obi,0.07500000000000001,-0.07500000000000001,negative
40,2022-12-20 12:33:46,obidients plssssss stop engaging reno tweets haba he is just cruising with you guys make him irrelevant by avoiding his malicious tweets,2,Peter Obi,0.85,-0.04999999999999999,negative
41,2022-12-20 12:32:57,o god of heaven please protect  and fellow  guide us in everything we do never let the plans of the wicked come to pass and come february election grant  victory at the polls in jesus mighty name i have prayed amen,0,Peter Obi,0.9,0.4,positive
42,2022-12-20 12:30:47,obidients and apc members dont open to avoid heart attack,5,Peter Obi,0.5,0.0,neutral
43,2022-12-20 12:30:34,obidients defending doyin okukpe corruption is just disgusting  isnt it better to keep mute than to defend something youre supposedly fighting against,0,Peter Obi,0.75,-0.25,negative
44,2022-12-20 12:26:57,apc ready more than obidients no wonder them dey kill bribe media houses use more propaganda and everything to rig or win the election  he used the word if we allow inec to remove bvas  he no talk say apc go win o  but prophecy dey change and apc no go win simple,0,Peter Obi,0.39464285714285713,0.4375,positive
45,2022-12-20 12:26:19,na so e be wen u decide to leave evil and follow good,0,Peter Obi,0.8,-0.15000000000000002,negative
46,2022-12-20 12:25:36,we don see him face,0,Peter Obi,0.0,0.0,neutral
47,2022-12-20 12:24:51,another vote for peter obi,0,Peter Obi,0.0,0.0,neutral
48,2022-12-20 12:24:36,theres still thousands of uncollected   i urge all gen z millennials and indeed all  to go get their  lets teach some of these hacks who wanna protect an old suppressive order how its done,0,Peter Obi,0.2,0.1,positive
49,2022-12-20 12:23:24,na d sender d parents go cry over cuz he or she will die a painful death,0,Peter Obi,0.9,-0.7,negative
50,2022-12-20 12:23:04,asin eeh some of the obidients are too weak and the plot is to make them talk like this and they are falling for it i dont blame them they are coming into the electoral and political process for the first time,1,Peter Obi,0.3527777777777778,-0.041666666666666664,negative
51,2022-12-20 12:21:57,u must be classically spid to think obidients will defend this we dont defend spidity our candidate is there to speak for himself he has been speaking and will keep speaking unlike some dead men walking who wanna impose themselves on nigerians god forbid bat tin,0,Peter Obi,0.2,-0.1,negative
52,2022-12-20 12:21:28,o yeah the jungle doth matureth weapon of massive disastrous governance replacement collected we meuve,219,Peter Obi,0.9,-0.35,negative
53,2022-12-20 12:21:14,hearty congratulations  obidients go and collect your pvc do not wait for last minute,27,Peter Obi,0.06666666666666667,0.0,neutral
54,2022-12-20 12:20:44,my people,0,Peter Obi,0.0,0.0,neutral
55,2022-12-20 12:20:25,i keep telling obidients life is about doing the right thing  about standing on the path of truth not following the crowd dnt settle for less,1,Peter Obi,0.2341269841269841,0.03968253968253968,positive
56,2022-12-20 12:20:10,there is no stopping   aso rock is assured  if you can read the room youll know that the ship has long sailed  did this,3,Peter Obi,0.4,-0.05,negative
57,2022-12-20 12:20:00,he say make we lp and obidients be ready say apc ready in all strata naim talk o make we no misunderstand him  he no say apc go win obut apc too dey desperate simple  again he no talk who go win too make we listen well na warning he they give us,1,Peter Obi,0.5261904761904762,0.2333333333333334,positive
58,2022-12-20 12:19:48,one more bullet to shoot down the agbado and mikano people   in the bag for   na  do this one  lets go there,52,Peter Obi,0.3944444444444445,0.17222222222222222,positive
59,2022-12-20 12:19:17,i have been doing that in peace and love it only obidients you will see insulting everyone that is not supporting peter obi that is obidients are not respecting democracy and freedom of choice  let see what  brings we shall all see the goodness of tinubu,0,Peter Obi,0.7125,-0.15625,negative
60,2022-12-20 12:19:05,you see the way this man keeps winning my heart each day ehn  i wished i had more than  vote see ehn it peter or nothing i no wan hear anything again,0,Peter Obi,0.4666666666666666,0.3666666666666667,positive
61,2022-12-20 12:18:41,most he talk about everything na him be buhari  abi no be una still wan vote atiku the main fulani man and tinubu d druglord and thug lord make una continue,0,Peter Obi,0.3277777777777778,0.15555555555555556,positive
62,2022-12-20 12:18:17,presidential candidate is a drug kingpin   vp is an election rigger   dg is a convicted money launder   god save nigeria from these criminals obidients right now,0,Peter Obi,0.5357142857142857,0.2857142857142857,positive
63,2022-12-20 12:18:00,this is a brilliant tweet obidients lets engage it,44,Peter Obi,1.0,0.9,positive
64,2022-12-20 12:17:32,obidients please can someone kindly tell me what is happening  today in akwa ibom uyo  tomorrow cross river calabar  next tomorrow rivers state ph  vawllence and pressing of neck activated  reno keyamo agbado doyin okupe,2,Peter Obi,0.3,0.19999999999999998,positive
65,2022-12-20 12:17:27,so peter obi na fulani now  una never know una problem,0,Peter Obi,0.0,0.0,neutral
66,2022-12-20 12:17:23,see fine woman,0,Peter Obi,0.5,0.4166666666666667,positive
67,2022-12-20 12:16:56,obidients i need current photos and updates from akwaibom with posharp sharp,0,Peter Obi,0.575,-0.0625,negative
68,2022-12-20 12:16:46,can you please imagine this  haaaaaaai god no value whatsoever for human lives and she wouldnt have died,0,Peter Obi,0.1,0.0,neutral
69,2022-12-20 12:16:18,throw your pvc into fire  as u no no wetin u go use am do sha ask the inec official where your polling unit is so u no go dey waka up and down on election day,1,Peter Obi,0.2888888888888889,-0.15555555555555559,negative
70,2022-12-20 12:15:23,obidients you know the drill block this latest fuul,1,Peter Obi,0.9,0.5,positive
71,2022-12-20 12:15:06,the offense of doyin okupe was under pdp tenure so the evil he failed to uproot came back to him  it has nothing to do with out incoming president  unless e no dey mind to vote po before so rest,0,Peter Obi,0.43333333333333335,-0.5,negative
72,2022-12-20 12:14:52,urchins agberos bandits kidnappers rishualists assassins narcotics terrorists looters money launderers drug pushers na the people wen the ashiere people congress  dey tell us say dem go fix this sick nation god forbid bat thing,0,Peter Obi,0.8571428571428571,-0.7142857142857143,negative
74,2022-12-20 12:12:10,is her buhari   abi no be una dah na ipob president  make una dey there dey  for  sit at home  on people  ewu  no go collect your pvc and vote obi so that nonsense will stop,0,Peter Obi,0.0,0.0,neutral
75,2022-12-20 12:12:09,this comment,0,Peter Obi,0.0,0.0,neutral
76,2022-12-20 12:11:41,na so so bandits agberos drug dealers narcotics terrorists rishualists assassins and money launderers in babanriga na dem you see so and yet some persons believe these are what the country needs to move further god forbid bat thing,0,Peter Obi,0.5,0.0,neutral
77,2022-12-20 12:10:49,many obidients dont knw that b d attacks n witchhunt of lp leadersmembers pdapc had promised po heaven n earth in exchge  his ambition but mans not having it  hear this again we are not doing po a favor by supporting him  akwa ibom katsina emefiele tinubu atiku apc pdp,11,Peter Obi,0.375,0.375,positive
78,2022-12-20 12:10:46,no retreat no surrender taken nigeria back is the obidients projects,0,Peter Obi,0.0,0.0,neutral
79,2022-12-20 12:10:14,god bless al mustapha,0,Peter Obi,0.0,0.0,neutral
80,2022-12-20 12:10:05,if he no win then no he only massacre go kill people  hunger and amp poverty plus dictatorship government will massacre everyone starting from you then your eye go clear  if peter decided to stop campaigning today  him and his family will never know poverty,0,Peter Obi,0.4708333333333333,-0.075,negative
81,2022-12-20 12:09:57,good one we can only concretize our commitment to this  movement called  by making the effort to get our pvcs  thank god i got mine already so obidatti plus one more vote all the way,0,Peter Obi,0.7000000000000001,0.39999999999999997,positive
82,2022-12-20 12:09:48,the same esn that the obidients call the nigerian terrorist security agencies to hunt and murder are the same ones that they are asking why they didnt protect those massacred by fulani terrorists   obidients and other one nigerianists should allow thunder to concentrate,21,Peter Obi,0.20833333333333334,-0.041666666666666664,negative
83,2022-12-20 12:09:48,any patriotic fellow knows  is in coma since   we the  are on rescue mission asuch the black attire by our leader   but insha allah  nigeria shall rise again,0,Peter Obi,0.21666666666666667,-0.13333333333333333,negative
84,2022-12-20 12:09:42,obidients come and see oooo hes now claiming that his account was hacked after threatening to kill me you will explain yourself at the police station when we are done with you apc wont save you from this  retweet,102,Peter Obi,0.0,0.0,neutral
85,2022-12-20 12:09:04,hauwa the almajiri i put it to you that you are the most gullible she goat  in the world right now alsooooooo your head is full of dippshiit and guhtter water you amp ur fellow agberos will learn the lessons of ur life in february  aleeribiruuku people congress,0,Peter Obi,0.5285714285714286,0.37857142857142856,positive
86,2022-12-20 12:08:59,obidients ll say otherwise   all katsina votes for them,0,Peter Obi,0.0,0.0,neutral
87,2022-12-20 12:08:53,just collected my pvc after a hard fought dying minute transfer of location  soldiers just added  im so glad,0,Peter Obi,0.7708333333333333,0.10416666666666666,positive
88,2022-12-20 12:08:42,more updates,1,Peter Obi,0.5,0.5,positive
89,2022-12-20 12:08:29,as he no write about it  tell your father to write about it  its very simple,0,Peter Obi,0.4642857142857143,0.0,neutral
90,2022-12-20 12:08:07,obi knew the kind of person okupe wasis and yet he chose to spare with him this much despite loads of young and capable people available to choose from if obi leads us it will be the same old story  obidients use your heads,0,Peter Obi,0.375,0.2285714285714286,positive
91,2022-12-20 12:08:06,wrote  leading presidential candidate he mr peter obi of labour party live at the townhall meeting with national obidients students at the rampr event center uyo akwa ibom state   akwa ibom for peter obi,0,Peter Obi,0.3,0.018181818181818174,positive
92,2022-12-20 12:07:49,if you have not heard any good news today this is it,1,Peter Obi,0.6000000000000001,0.7,positive
93,2022-12-20 12:07:25,why are some of those that support obi ambitions are publicly asking obidients to rein in  to drop,0,Peter Obi,0.06666666666666667,0.0,neutral
94,2022-12-20 12:07:14,local loll,0,Peter Obi,0.0,0.0,neutral
95,2022-12-20 12:07:13,al mustapha hes an asset  needs most some loop holes needs to be filled then rebuilding of new nigeria,0,Peter Obi,0.6181818181818182,0.34545454545454546,positive
96,2022-12-20 12:06:00,i think he should not wait for anyone to ask him to step aside our mantra as obidients is transparent honesty having an exconvict on the saddle is disquieting,0,Peter Obi,0.0,0.0,neutral
97,2022-12-20 12:05:22,all the obidients in my mentions defending the fulani terrorist herdsmen massacre in enugu will also face the same fate i thought they were just naive but i can see they are just evil and wont go unpunished nigeria must be dismantled and no amount of blackmail can stop that,12,Peter Obi,0.7083333333333334,-0.43333333333333335,negative
98,2022-12-20 12:05:20,you went far ask reno mockery to come back to nigeria if got balls and claim to be clean,0,Peter Obi,0.5666666666666668,0.15555555555555556,positive
101,2022-12-20 12:03:24,these calabar drivers are all obidients and it so sweet,0,Peter Obi,0.65,0.35,positive
102,2022-12-20 12:03:19,it runs in your family trait,0,Peter Obi,0.0,0.0,neutral
103,2022-12-20 12:03:06,more grace sir,15,Peter Obi,0.5,0.5,positive
104,2022-12-20 12:03:00,people of uyo will never disappoint us kw ibom is obidients to the core beautiful people beautiful colors,1,Peter Obi,1.0,0.85,positive
105,2022-12-20 12:02:38,shame on your father,0,Peter Obi,0.0,0.0,neutral
106,2022-12-20 12:02:26,tinubu has not been talking to us the media the problem is he has being talking but you are not listening you rather prefer someone who will start quoting abracadabra statistics an economic maguire,2,Peter Obi,0.2,0.2,positive
107,2022-12-20 12:02:21,some of you are waiting for the criminal politicians to queue behind  before you will follow them to support him sorry ooooo  average nigerians should do everything humanly possible to elect his excellency po because he is there for us and all the poor nigerians,1,Peter Obi,0.7357142857142857,-0.14999999999999997,negative
108,2022-12-20 12:02:06,dear obidients let understand their pdapcgame plan over the weekendit was madam aisha yusuf today it doyin they want to pin us down in defensive battle to blunten our attack its the attacking team that wins the battle,0,Peter Obi,0.24444444444444446,0.0722222222222222,positive
109,2022-12-20 12:00:16,obidients read and pass round,0,Peter Obi,0.4,-0.2,negative
110,2022-12-20 11:58:48,see reasons to vote for the  best candidate tinubu apc,0,Peter Obi,0.3,1.0,positive
111,2022-12-20 11:58:27,we are talking about winning election you are talking about disrespecting obidients online this is why the establishment dont see us as threat yall dont act like you truly want to win   winningdisrespect,0,Peter Obi,0.575,0.65,positive
112,2022-12-20 11:57:26,this is the kind of energetic president we need thank god for this opportunity god has indeed heard our prayers,1,Peter Obi,0.7,0.55,positive
113,2022-12-20 11:56:43,sorry our mumu don do okowa will take over from you soludo will take over from ihedioha will take over from you  stop bragging with what you dont have president is not your birth rite  we will surely reply to your insult at the polls,0,Peter Obi,0.9444444444444444,0.0,neutral
114,2022-12-20 11:56:37,youre right pdapc have been working hard to undermine peter obi and obidients,1,Peter Obi,0.5386904761904762,-0.0029761904761904934,negative
115,2022-12-20 11:54:50,pdp will get their votes from the optics of hiring persons they pay n each to fill the stadium they are even hiring obidients today in their katsina rally can confirm their tricks e go shock them,2,Peter Obi,0.0,0.0,neutral
116,2022-12-20 11:53:39,a conviction with a political undertone aimed at distracting and destabilizing the obidients we move on,1,Peter Obi,0.1,0.0,neutral
117,2022-12-20 11:52:20,breaking news dear obidientstop investigations are on to find out if justice ijeoma ojukwu of federal high court abuja who sentenced doyin okupe is not an anambrarian grngorian if yes its most unfair for her to have convicted lp dr doyin okupe on shit at home daynaanu,0,Peter Obi,0.71,-0.009999999999999995,negative
118,2022-12-20 11:52:12,ive collected my pvc sir from inec office in mageji ngeri kaduna north lg just behind labour party campaign office  obi u do this one   obidients let follow each other,27,Peter Obi,0.5375,-0.2625,negative
119,2022-12-20 11:51:40,has been endorsed using his veto powers fear who no fear obidients  thank you akwaibom for accepting our invite to the   next calabar are you ready we are coming in hot tomorrow,14,Peter Obi,0.45,0.15,positive
120,2022-12-20 11:51:18,true obidients over to you,1,Peter Obi,0.65,0.35,positive
121,2022-12-20 11:50:43,it will choke you that peter obi will come far to the third placebut if i may ask did you think i am really suffering like you said verify the life of obidients before you say this to me again   desperate souls,0,Peter Obi,0.55,-0.07499999999999998,negative
122,2022-12-20 11:49:56,breaking news dear obidientstop investigations are on to find out if justice ijeoma ojukwu of federal high court abuja who sentenced doyin okupe is not an anambrarian grngorian if yes its most unfair for her to have convcted lp dr doyin okupe on shit at home daynaanu,0,Peter Obi,0.71,-0.009999999999999995,negative
123,2022-12-20 11:49:03,peter obi the obidients and the burden of defending their exconvict campaign dg  read here,0,Peter Obi,0.0,0.0,neutral
124,2022-12-20 11:48:53,nigeria is looking for fresh man like  and datti baba ahmed daz our line kuma we no go change am  peter obi will become our president by god grace nigeria is one hausa igbo yoruba all of us na,4,Peter Obi,0.5,0.3,positive
125,2022-12-20 11:48:49,you either vote for obi or remain a slave forever i cant say more than this i am from the blessed generation of jacob most of those sycophants are from the generation of esau who sold his birthright for a morsel of meat god bless all obidients everywhere pls retweet,5,Peter Obi,0.5,0.5,positive
126,2022-12-20 11:48:02,my beloved  have you tweeted about   today  lets leave no stone unturned o our country is no longer serving us o we need to fix it    bvas    pvc,15,Peter Obi,1.0,0.7,positive
127,2022-12-20 11:47:53,okupe is not stepping aside this is the reason for his conviction to damper on the obidients and it will not work,0,Peter Obi,0.0,0.0,neutral
128,2022-12-20 11:47:30,i thought you were different i know youre pained because youve not been able to raise k for your yearly cash out presidential campaign obidients are not responsible for your problem   is better,1,Peter Obi,0.5687500000000001,0.225,positive
129,2022-12-20 11:46:38,of men and women are on this table,0,Peter Obi,0.0,0.0,neutral
130,2022-12-20 11:44:51,nigerians are arisetv so you dont know bro nigerians are obidients who wont vote him  people of pharisee,7,Peter Obi,0.0,0.0,neutral
131,2022-12-20 11:44:37,please obidients avoid tweets from this userdont engage her tweets  let make her irrelevant like we did to reno,7,Peter Obi,1.0,-0.5,negative
132,2022-12-20 11:44:27,obidients are we campaigning for doyin okupe nop so what ever thing the find on him doesnt concern us obi is for president and no stain dey his white it is obi or no one,3,Peter Obi,0.0,0.0,neutral
133,2022-12-20 11:43:43,theres nothing like impossibility i think obidients should wake up from their slumber and see the true reality labour party will take  nigerians no where it a party for the actualization of fake hope for southeast presidency  everybody knows that,0,Peter Obi,0.825,-0.07500000000000001,negative
134,2022-12-20 11:41:42,doyin okupe to pay n fine and bear the tag exconvict for life he will be removed as  cdg we obidients have accepted it can tinubu and his party forget about  as we cant afford an exconvict leading nigeria  is on the right track,0,Peter Obi,0.5178571428571428,0.35119047619047616,positive
