,date,tweet,nlikes,Candidate,Subjectivity,Polarity,Analysis
0,2022-12-17 00:38:55,good works hope yall staying safe out therethese unwarranted attacks on lp  obidients nationwide is becoming worrisome day after day  god bless everyone in and outside po pcc list amen,0,Peter Obi,0.5,0.4125,positive
2,2022-12-17 00:36:19,he needs more penetration rural support no nau  when obidients say we will shock you when obidients say plateau in the bag edo in the bag rivers in the bag kaduna in the bag anambra in the bag i thought they had penetrated everywhere already,0,Peter Obi,0.25,0.25,positive
3,2022-12-17 00:34:49,obi should caution obidients they should not be insulting the obi of onitsha so if he wins they will insult all our traditional rulers,0,Peter Obi,0.65,-0.2333333333333333,negative
4,2022-12-17 00:32:03,lol in your shallow mind you think it just obidients his party faithfuls in apga who have a candidate from anambra also heard him loud and clear and i can assure you they got the memo and will serve him his due wage,0,Peter Obi,0.5516666666666666,0.10833333333333335,positive
5,2022-12-17 00:27:49,it will be an i no go gree protest for the obidients at last,0,Peter Obi,0.06666666666666667,0.0,neutral
6,2022-12-17 00:23:36,creativity unbound obidients watch enjoy it,0,Peter Obi,0.5,0.4,positive
7,2022-12-17 00:22:47,malete kwara state obidients in the field to win more hearts and hands that will help peter obi build a better nigeria  oba of benin obi of onitsha empress njamah soludo akwa ibom lagos adesua ekiti yoruba david hundeyin mazi simon ekpa dbanj,4,Peter Obi,0.4666666666666666,0.6,positive
8,2022-12-17 00:14:13,obidients on a boat heading to kosofe lga of lagos state to sensitise the people about peter obi and labour party this hard work is beyond pdapc  oba of benin obi of onitsha empress njamah soludo akwa ibom lagos adesua ekiti yoruba david hundeyin mazi simon ekpa dbanj,6,Peter Obi,0.5416666666666666,-0.2916666666666667,negative
9,2022-12-17 00:09:30,we have to move from sharing formula to production formula  peter obi,0,Peter Obi,0.0,0.0,neutral
10,2022-12-17 00:05:33,please make una find me transport money i wan go back east and wait till next year to cast my vote before coming back obedient for life ja must better,0,Peter Obi,0.25833333333333336,0.11666666666666665,positive
11,2022-12-17 00:04:46,truth be told you lose a large part of your humanity when you become obidient it shows all over twitter  response to  tweet is proof   response to same tweet reveals he one too  obidients are the vilest people on twitter,0,Peter Obi,0.2767857142857143,0.10714285714285714,positive
12,2022-12-17 00:02:58,worry about atiku let obidients worry about obi,0,Peter Obi,0.0,0.0,neutral
13,2022-12-17 00:00:22,the  widow umahi is feeding have been made the structure obidients need to make up that structure now by securing their pus,0,Peter Obi,0.0,0.0,neutral
14,2022-12-16 23:57:39,the truth is that inside agbados camp there are many obidients february th will come with a shock for them,0,Peter Obi,0.5,0.5,positive
15,2022-12-16 23:49:52,the akwette gov of anambra state has been tagged oneterm gov for his treachery n selfish sellout  r poised n ready to take his seat to remind him that he is nothing but a neophyte in politics  is wasting time in anambra as  of d votes will not even reach him,0,Peter Obi,0.75,-0.15,negative
16,2022-12-16 23:47:46,obidients hypnotised by deceitful  will never reason instead of going into the hinterland to campaign  they hv even cancelled state ones they will rather choose to remain online to spew hate and bigotry,0,Peter Obi,0.9,-0.8,negative
17,2022-12-16 23:43:08,you are one of the two frontrunners for the presidency of nigeria amp in the fullness of time we going to have a conversation    the statement by soludo pained the obidients they couldnt believe that gov soludo will make such a statement i felt for them,3,Peter Obi,0.5,0.0,neutral
18,2022-12-16 23:41:00,you have guts to come here and open ur mouth waaa and spill rubbish abi  obidients i want to know everything about this dude in hrs maybe i should use u as a scape goat,0,Peter Obi,0.5,0.0,neutral
19,2022-12-16 23:34:40,twitter  spaces is back thanks  and  never realized the addition was real,0,Peter Obi,0.16666666666666666,0.13333333333333333,positive
20,2022-12-16 23:34:17,you will be the one to insult people and turn around and call obidients unprintable names but no need engaging you because you are so shameless and classless you dont even have a penny worth of integrity remaining fix your home first before we can listen to you,0,Peter Obi,0.37777777777777777,0.31666666666666665,positive
21,2022-12-16 23:32:37,a serial looser can not promise what he is beginning for and hasnt got the waziri of adamawa is a wishful thinker unfortunately is dreams will be crushed by zealous obidients in  elections,0,Peter Obi,0.55,-0.3,negative
22,2022-12-16 23:32:23,please dont be deceived by this statement  labour party lacks structure  obidients take up the structure now,0,Peter Obi,0.0,0.0,neutral
23,2022-12-16 23:30:06,what is going on why are obidients facing untimely and sudden death,0,Peter Obi,0.5,0.0,neutral
24,2022-12-16 23:29:00,every apc n pdp supporter needs to listen to this tape with a open mind for the first time  this is what peter obi represents and why it seems we obidients are never going to stop pushing him,0,Peter Obi,0.41666666666666663,0.125,positive
25,2022-12-16 23:23:47,unfortunate how pdp guys thought that peter obi is on the ruling party every second peter obi this obidients that useless opposition,0,Peter Obi,0.39999999999999997,-0.3333333333333333,negative
26,2022-12-16 23:22:31,obidients are unique,1,Peter Obi,1.0,0.375,positive
27,2022-12-16 23:21:30,see fine obidients nah who dey zuzu,1,Peter Obi,0.5,0.4166666666666667,positive
28,2022-12-16 23:19:35,is our year that  will rewrite the history of nigeria by voting massively for  and we will retire the old politicians from politics victory is assured peter obi will win,1,Peter Obi,0.5333333333333333,0.3,positive
29,2022-12-16 23:18:05,im going to  upcoming space will you join too,0,Peter Obi,0.0,0.0,neutral
30,2022-12-16 23:16:22,may righteous god continue to protect  and all   and may god of justice intervene in hon christopher eleghu murder,0,Peter Obi,0.0,0.0,neutral
31,2022-12-16 23:16:03,thank you obidients thank you nigerians and most especially  for making it easier to sell him to the electorates peter obi is not just coming he is here and going there,7,Peter Obi,0.75,0.25,positive
32,2022-12-16 23:13:39,you know the truth obidients are everywhere we will secure the polling units,0,Peter Obi,0.6,0.4,positive
33,2022-12-16 23:11:41,the obidients,0,Peter Obi,0.0,0.0,neutral
34,2022-12-16 23:10:56,some obidients are just silly and emotional political daniel reghas,1,Peter Obi,0.5416666666666666,-0.16666666666666666,negative
35,2022-12-16 23:08:22,obidients let retweet this after watching this if you feel it worth a retweet you know what to do  peter obi is coming,0,Peter Obi,0.1,0.3,positive
36,2022-12-16 23:08:21,obidients please remember   we are ipob  we dont have pvcs  we are keypad warriors  we dont have the structure  we are four people tweeting in a room  we are the underdogs we have nobody but we have god if god is with us who can be against us who,0,Peter Obi,0.0,0.0,neutral
37,2022-12-16 23:07:04,obidients please remember   we are the indaboski  we are  the bahose  we are the liquid metals  we are the fight  the lions the lion himself  with god by our sides pvc in our hands and data in our phones  no bat or uniscatter can defeat us,0,Peter Obi,0.0,0.0,neutral
38,2022-12-16 23:06:47,when nigeria callsyou can never be silent if your a patriotic nigerian,2,Peter Obi,0.1,0.0,neutral
39,2022-12-16 23:06:08,by population they may have more obidients because lagos is more populated than edo   the difference may be that on election day edo obidients can resist and push back armed thugs that may come to disrupt peter obis stronghold can our lagos obidients resist tinubus thugs,1,Peter Obi,0.3333333333333333,0.3333333333333333,positive
40,2022-12-16 23:05:22,get baba to sign that peace accord now,9,Peter Obi,0.0,0.0,neutral
41,2022-12-16 23:04:58,obidients in anambra should kindly leave the obi of onitsha hrm igwe achebe alone and continue licking their wounds  was a huge success and come  he alh atiku abubakar  will win anambra with a landslide victory know this and know peace,0,Peter Obi,0.55,0.525,positive
42,2022-12-16 23:02:35,my brother sorry the politicians put this problem among us so that we will be continually divided forgive other obidients na frustration that our leaders put on all of us vote obi and datti to take our country back from bad leaders,0,Peter Obi,0.5104166666666666,-0.33124999999999993,negative
43,2022-12-16 23:00:59,stop attacking obidients and labour party stop attacking obidients and labour party stop attacking obidients and labour party stop attacking obidients and labour party stop attacking obidients and labour party stop attacking obidients and labour party,0,Peter Obi,0.0,0.0,neutral
44,2022-12-16 23:00:44,edo seems to be the spiritual home of obidients,0,Peter Obi,0.13333333333333333,0.0,neutral
45,2022-12-16 23:00:08,please obidients dont expose yourself these thieves pdp and apc are not playing theyre vicious and malicious,0,Peter Obi,1.0,-1.0,negative
46,2022-12-16 23:00:02,posters are fast becoming obsolete in our electioneering system thanks to obidients,2,Peter Obi,0.55,0.2833333333333334,positive
47,2022-12-16 22:59:02,obidients we need answers,0,Peter Obi,0.0,0.0,neutral
48,2022-12-16 22:58:59,please stay safe obidients please dont expose yourselves these apc and pdp members are very criminal minded theyre vicious and malicious,1,Peter Obi,0.7383333333333333,-0.34,negative
49,2022-12-16 22:58:14,shetima no dey laugh  baba get una for mind obidients,1,Peter Obi,0.1,0.3,positive
50,2022-12-16 22:55:37,it is weird how some people think if buhari comes out today and support peter obi some  obidients will say buhari is the best president ever how does buhari body language affect you as an obidient,0,Peter Obi,0.65,0.25,positive
51,2022-12-16 22:55:12,ah as long as she didnt join the obidients she made the wrong choice and they will harangue abuse curse intimidate and threaten her and even her innocent husband so sad,0,Peter Obi,0.75,-0.1375,negative
52,2022-12-16 22:53:03,how can u say this fellow is a respected man respected by who,0,Peter Obi,0.0,0.0,neutral
53,2022-12-16 22:51:38,great idea for the obidients,0,Peter Obi,0.75,0.8,positive
54,2022-12-16 22:50:01,sir we the electorate obidients have decided,0,Peter Obi,0.0,0.0,neutral
55,2022-12-16 22:49:02,let support  so that the labour party candidates in lagos  and our presidential candidate will receive the necessary momentum through the victory of all legislative candidates,5,Peter Obi,1.0,0.0,neutral
56,2022-12-16 22:48:11,obidients should take note of the following evil groups council of chiefs all governors senators reps and state assembly from the southeast these people are putting their monetary interest ahead of south east future we shall replace all of them with labour party come,0,Peter Obi,0.4083333333333334,-0.3333333333333333,negative
57,2022-12-16 22:47:15,my youngest sister got married today and obidients were properly represented,140,Peter Obi,0.175,0.125,positive
58,2022-12-16 22:46:16,nigeria cannot be fixed but obidients will never hear ndigbo will bear the brunt of this fruitless venture,1,Peter Obi,0.2,0.1,positive
59,2022-12-16 22:44:53,if atiku trend just know nna  dey run their mouthhand on twitter,1,Peter Obi,0.0,0.0,neutral
60,2022-12-16 22:43:47,shey north west no dey among this obidients,0,Peter Obi,0.0,0.0,neutral
61,2022-12-16 22:40:42,not the same obi we know sha  baba iyalaya capitalist  just that the obidients dey ment anyhow now,1,Peter Obi,0.125,0.0,neutral
62,2022-12-16 22:38:13,bat is a disaster avoid it  imagine youre on a flight flying with the head pointing downwards that bat  dont be unfortunate  apc  rinu obidients amoda seyi adamu yorubas southeast labour macaroni aisha,1,Peter Obi,1.0,-0.5,negative
64,2022-12-16 22:37:04,obidients let embark on operation mobilize your polling unit for po,4,Peter Obi,0.0,0.0,neutral
65,2022-12-16 22:36:30,the delusionional differences  obidients are mentally deranged  mandela spent  years in prison   he was importing heinz salad cream while his people suffered   obi never fought the abacha or ibb military government  obi murdered young people ezu river killings,9,Peter Obi,0.2,-0.05000000000000001,negative
66,2022-12-16 22:35:43,so obi is coming to my beloved state akwa ibom  obidients make some noise  we no dey carry last  lagos edo ph  akwa ibom is taking overyall wait till next week,0,Peter Obi,0.35555555555555557,0.2333333333333333,positive
67,2022-12-16 22:33:31,peter obi has been patient and playing maturity with soludo but it like soludo is taken his humility for granted also obidients have been on the defensive for over a week now and this must stop our spokespersons need to change the narrative,1,Peter Obi,0.0,0.0,neutral
68,2022-12-16 22:31:33,azzin ba this people no dey rate us at all wallahi obidients meeehn,0,Peter Obi,0.0,0.0,neutral
69,2022-12-16 22:27:47,may god bless all obidients groups,1,Peter Obi,0.0,0.0,neutral
70,2022-12-16 22:24:24,akwa ibom state is a goal for obi atiku know this pdp know this and pretty much everyone knows it,0,Peter Obi,0.6,0.225,positive
71,2022-12-16 22:23:25,may his soul rest in peace theyre threathened and are trying to put fear in the mind of obidients but they have failed woefully,1,Peter Obi,0.3,-0.5,negative
72,2022-12-16 22:23:14,pls i appeal to all obidients to enlighten people as we approach the dday to take back nigeria,0,Peter Obi,0.0,0.0,neutral
73,2022-12-16 22:22:04,obidients in the north are some of the most serious supporters of peter obi after south finished their rallies the north went into community mobilization mode   efcc adeleke awka osun niger bridge buhari dangote oyetola  anambra toke lgbo dbanj adesua,1,Peter Obi,0.5833333333333333,0.08333333333333334,positive
74,2022-12-16 22:21:39,that ploy to reduce obidient movement in south east will fail im in anambra and im fully obidients,0,Peter Obi,0.29999999999999993,-0.5,negative
75,2022-12-16 22:21:32,so atiku is coming to owerri tomorrow and my mum phone been ringing since morning her excuse ndia nwechara other engagements amp im out of town   imo pdp dey mobilise like their  life depends on it to fill up heroes square since po obidients finished work last week,1,Peter Obi,0.1638888888888889,-0.05833333333333333,negative
76,2022-12-16 22:20:09,he always tag those who support and even ask true obidients to thank themnot fake obidients like you that sabotage pple effort,0,Peter Obi,0.825,-0.07500000000000001,negative
77,2022-12-16 22:17:58,since he cant win then why bother yourself with his failure n allow atiku defeat him in the pool instead of always killing his membersone thing you all bad eggs should know is that no amount of killings that can weak our soul as we obidients are all set to see this country work,0,Peter Obi,0.4979166666666667,-0.14791666666666664,negative
78,2022-12-16 22:17:45,if he tels dem dat obidients ar d  gving him moni pple wil consider it as voting   if i may ask av u eva given him moniif not shut ur dirty mouth cus dose wu do dat av never complained cos of d resultthe result mata dan to mention wu gves moni,0,Peter Obi,0.5,-0.22499999999999998,negative
79,2022-12-16 22:16:24,chai the alert done drop thanks for all you do for the obidients boss may ur pocket never run dry ijn amen,0,Peter Obi,0.4,0.06666666666666668,positive
80,2022-12-16 22:16:22,this will make it  strong members of obidients and labour party killed in the space of weeks tinubu should explain to nigerians why he was unavailable for signing of peace accord with all other political parties,104,Peter Obi,0.30208333333333337,0.02708333333333332,positive
81,2022-12-16 22:15:47,the love between obidients and po is what the bible calls agape love while the love between bathrooms and bulaaba is called the ashamgba love,1,Peter Obi,0.6,0.5,positive
82,2022-12-16 22:14:40,hey  amp other obidients i sincerely advise that you stop focusing on soludo amp his antics let the sole focus be on obidatti for now at the appropriate time after election has been won you can come back to this lesser matter,6,Peter Obi,0.3541666666666667,0.14583333333333334,positive
83,2022-12-16 22:13:14,if we the obidients decide to ignore this manhe will become so irrelevant who is with me,0,Peter Obi,1.0,-0.5,negative
84,2022-12-16 22:12:47,may his soul rest in perfect peace and may all obidients and labour party members be protected against such incident in jesus name amen,1,Peter Obi,0.75,0.5,positive
85,2022-12-16 22:12:13,welcome backsis give dem wotowoto day do smesme na so dem go abuse obidients wen we reply some wey drink gutter water go say we be rudeyen yenyen dem go hear e dey sweet us as e dey pain dem,0,Peter Obi,0.775,0.575,positive
86,2022-12-16 22:09:46,see insults abuse and cyber bullying after theyll start calling obidients using reverse psychology shame on you boy,0,Peter Obi,0.0,0.0,neutral
87,2022-12-16 22:09:04,labour partylp is winning this election theres nothing they can do to stop us lp ship has sailed we dont have structures yet they are scared if we dont have a change they wont fight us dirtywhy didnt they attack kwankwaso or sowore obidients we are almost there,2,Peter Obi,0.75,0.5,positive
88,2022-12-16 22:04:12,i will condemn ur father for not using condom,31,Peter Obi,0.0,0.0,neutral
89,2022-12-16 22:04:02,sincerely i had no choice then to mute reno omokri cos i found out he just tweet to seek traffic on his wall using the obidients as a market strategy now i have peace of mind and well focused,1,Peter Obi,0.5,0.5,positive
90,2022-12-16 22:03:50,akwa ibom  peter obi is coming obidients are you ready lets shutdown uyo for   venue unity park udo udoma avenue uyo  date tuesday dec th   be there,4,Peter Obi,0.5,0.2,positive
91,2022-12-16 22:03:39,they will fail you are our next president  its recorded in heaven  the election is won,0,Peter Obi,0.14999999999999997,-0.25,negative
92,2022-12-16 22:03:35,come to asabaall civil servantstraders artisans are all obidients okowa has an uphill task all my friends in warri sapele are saying same too,1,Peter Obi,0.125,0.0,neutral
93,2022-12-16 22:01:38,this is the bitter truth so many so many obidients dont want to hear thanks goodness we have someone that has understanding,1,Peter Obi,0.425,0.275,positive
94,2022-12-16 21:57:32,se obidients will surprise these contractors,0,Peter Obi,0.0,0.0,neutral
95,2022-12-16 21:56:48,does obi even believe in referendum or restructuring you guys shouting obidients are uninformed,0,Peter Obi,0.0,0.0,neutral
96,2022-12-16 21:56:00,obidients in akwa ibom must start down that rally,6,Peter Obi,0.2888888888888889,-0.15555555555555559,negative
97,2022-12-16 21:55:17,we pray so much in this country but we end up making bad decisions and what we experience today is as a result of the decision we made yesterday v the vote wisely you most times read from obidients isnt an insult or a sign of rudeness,0,Peter Obi,0.5666666666666667,0.17500000000000004,positive
98,2022-12-16 21:54:10,bruh go and collect your pvc,0,Peter Obi,0.0,0.0,neutral
99,2022-12-16 21:51:58,i repeat  to  of those in apc and pdp rallies are obidients they are just playing the game with politicians their votes will go to peter obi of lp on election day   god bless peter obi  god bless obidients  god bless nigeria,3,Peter Obi,0.4,-0.4,negative
100,2022-12-16 21:51:35,obidients are foolish sets of dunderhead they never believe obi is a poster boy where el rufai dey,1,Peter Obi,0.0,0.0,neutral
101,2022-12-16 21:50:12,obidients are not the cause of your glaucoma it curable,2,Peter Obi,0.0,0.0,neutral
102,2022-12-16 21:49:40,friday midnight gain for the obidients were still taking over this space drop your handle and follow each other first follow,310,Peter Obi,0.35416666666666663,0.0625,positive
103,2022-12-16 21:46:25,islamic society becomes obidients as they hold rally to campaign for obidatti    a video has emerged o,0,Peter Obi,0.0,0.0,neutral
104,2022-12-16 21:46:10,only south easterners are obidients wait till feb  your eyes will open,2,Peter Obi,0.75,0.0,neutral
105,2022-12-16 21:45:49,oga this your narrative no follow at all make sensible campaign please obidients are smart and sensible,0,Peter Obi,0.6428571428571429,0.21428571428571427,positive
106,2022-12-16 21:45:14,dear   please share let keep going its just over  months left,2,Peter Obi,0.0,0.0,neutral
107,2022-12-16 21:44:29,apc thought they would takeover sm and use it for their advantage like they did in  so they quickly unbanned twitter cos of elections if they knew better they wouldve left it banned cos obidients are making the streets unbearable for themeven paid influencers are inactive,0,Peter Obi,0.3333333333333333,0.27777777777777773,positive
108,2022-12-16 21:44:04,reality is hitting obidients ooo theyre humbled by the low turnout in nassarawa and kogi   months ago obedients were like nassarawa is going to give obi  votes now theyve lower their expectations to  what a time to be alive,0,Peter Obi,0.35,0.05,positive
109,2022-12-16 21:42:56,bats pictures are all over abuja but out of every  living things you ask  and half are obidients,596,Peter Obi,0.16666666666666666,-0.16666666666666666,negative
110,2022-12-16 21:41:58,obidients this is structure,0,Peter Obi,0.0,0.0,neutral
111,2022-12-16 21:40:15,just dey play jam this guy na cast    vawulence night   drop your line  mine     you nor wan come debate but you wan become president just dey play dey play oo dey play   name the person  and run,1,Peter Obi,0.15000000000000002,-0.2,negative
112,2022-12-16 21:39:52,may god protect him we are living in dangerous times obidients have become endangered species,0,Peter Obi,0.9,-0.6,negative
113,2022-12-16 21:38:49,obidients dancing after election y are you crying simple say what you love of your bat and you are here fighting do want him to ask what you hate about tinubu hiaa,0,Peter Obi,0.6142857142857142,-0.125,negative
114,2022-12-16 21:34:01,obidients na win win team i like thier energy  thank you man,0,Peter Obi,0.4,0.8,positive
115,2022-12-16 21:33:14,you have started the insult  if obidients fire you back now fulani terrorist you will begin to cry   ode,0,Peter Obi,0.0,0.0,neutral
116,2022-12-16 21:32:49,una do this one oh,0,Peter Obi,0.0,0.0,neutral
117,2022-12-16 21:31:32,amen please keep praying for obidients and labour party members they are killing us,0,Peter Obi,0.0,0.0,neutral
118,2022-12-16 21:30:56,i wish obidients will listen,0,Peter Obi,0.0,0.0,neutral
119,2022-12-16 21:29:47,they say obidients are toxic  yet they murder us we are taking notes  every fallen comrade will get justice when peter obi ascends the throne,4,Peter Obi,0.0,0.0,neutral
120,2022-12-16 21:29:14,nelson mandela delivered his county south africa from bad governance during his time he was embraced by south africans just like the obidients have become a movement to vote in peter obi who is the deliverer that nigeria needs at this time,0,Peter Obi,0.6666666666666666,-0.6999999999999998,negative
121,2022-12-16 21:27:53,one million man match you tried but couldntt match   campaign rallies  even your principal can not address his supporters goampverify you tried and drugs scandal and lies busted all known opinion pools  is still leading in all,0,Peter Obi,0.0,0.0,neutral
122,2022-12-16 21:26:33,obidients are funny peoplethey want soludo to support po that left apga,0,Peter Obi,0.5,0.125,positive
123,2022-12-16 21:25:02,abia state is  obidients  save this and confirm come february next year,0,Peter Obi,0.0,0.0,neutral
124,2022-12-16 21:24:30,those obidients are mobs they dont have head so they dont reason  dont waste ur time my senator,0,Peter Obi,0.0,-0.2,negative
125,2022-12-16 21:22:56,the people obidients exposed their uselessly unseen stupidity include  ffk  reno  dino  keyamo  atiku  tinubu  ayu  ekeremadu  soludo  sen kalu  most apc governors  please add yours,0,Peter Obi,0.5666666666666667,-0.20000000000000004,negative
126,2022-12-16 21:20:46,that how you people will abuse and bully obi and his movement and yet turn around and shout to high heaven that obidients are insulting you look at you now mchew,0,Peter Obi,0.77,-0.42,negative
127,2022-12-16 21:16:58,the way obidients are collecting pvc and showing receipts makes me more confident that obi is on the waytheir insults abt us not having pvc turns out to be our motivation to go and collect it under sunand is now competition on collect and show evidenceam loving it,8,Peter Obi,0.7611111111111111,0.5333333333333333,positive
128,2022-12-16 21:16:53,wow didnt know you just lost the old account anyway while were here kindly follow back like you were in old account,0,Peter Obi,0.4600000000000001,0.18,positive
129,2022-12-16 21:16:47,please sir forgive peter obihe is one of our own before he went to labour partyi can understand what his obidients fans has done to you and you familybut i want you to know god is above them sirobi never send them the messages they are delivering,0,Peter Obi,0.55,0.3,positive
130,2022-12-16 21:14:03,he attacks agbado occasionally too but since that doesnt give him any serious engagements he doesnt continue and soon returns to obi he a manipulator if all obidients will heed the advice to stop commenting in no time hell fizzle out control yourself ignore his tweets,0,Peter Obi,0.3958333333333333,-0.16666666666666666,negative
