,date,tweet,nlikes,Candidate,Subjectivity,Polarity,Analysis
17,2022-12-20 13:01:40,btw what happens when tinubu wins how will we react  what happens if obi wins how do we react  what happens if atiku loses how do we react  man has to ponder these things because e dey usually dey like film next thing you know,0,Atiku Abubakar,0.15,0.009999999999999998,positive
18,2022-12-20 13:01:18,he  visit to the mother of late president umaru musa yaradua,0,Atiku Abubakar,0.6,-0.3,negative
19,2022-12-20 13:01:17,go and look for work frustrated being very soon all you criminals hiding under ipob to perpetrate evil will be exposed,0,Atiku Abubakar,0.5,-0.5,negative
20,2022-12-20 13:01:13,come back to nigerian an campaign for  you must win your polling unit ward and local government noisemaker,1,Atiku Abubakar,0.13333333333333333,0.26666666666666666,positive
21,2022-12-20 13:01:12,nigerias time to recover with,0,Atiku Abubakar,0.0,0.0,neutral
22,2022-12-20 13:01:08,atikus visit to anambra in order  traditional rulers council,0,Atiku Abubakar,0.75,0.0,neutral
23,2022-12-20 13:01:08,and your obi also is in their midst he is also part of the birds and at least he acknowledged atiku the thief to be his boss so he too is a thief okupe is a thief  also stop pushing a thief on us too,0,Atiku Abubakar,0.4,-0.3,negative
25,2022-12-20 13:01:03,but atikuobi unsuccessfully rigged  na the same ship carry them,0,Atiku Abubakar,0.125,0.0,neutral
26,2022-12-20 13:01:00,who  supporting in this  presidential election cos it not enough to cry,0,Atiku Abubakar,0.375,0.125,positive
27,2022-12-20 13:00:50,katsina youths shun  as he visit for presidential campaign today,1,Atiku Abubakar,0.0,0.0,neutral
28,2022-12-20 13:00:35,a reminder to apc amp pdp that they cant  fight grace neither can the fight nigerians we av made our choice amp is final        labour party kano mbappe  doyin okupe christmas african giant atiku tinubu  buhari peter obi,7,Atiku Abubakar,0.6666666666666666,0.0,neutral
29,2022-12-20 12:59:11,he atiku abubakar and his recovery team paid a courtesy visit to the emir of katsina state,1,Atiku Abubakar,0.0,0.0,neutral
30,2022-12-20 12:58:58,the only thing i can plead with nigerians including asiwaju bola ahmed tinubu and  is they should please let nigeria function again by allowing peter obi  win come  there votes counts a lot they must support po,1,Atiku Abubakar,0.7,0.4,positive
31,2022-12-20 12:58:50,insha allah haba allah will not be happy with you o,0,Atiku Abubakar,1.0,0.8,positive
33,2022-12-20 12:58:37,you ought to show good example for those you portend to be better than to follow calling peter obi anini or monday osunbor shows how bitter youre especially now that atiku has lost the election before february now that five pdp governors have declared support for peter obi,1,Atiku Abubakar,0.65,0.27499999999999997,positive
34,2022-12-20 12:58:13,listen very well and dont be deceived by apctinubu and atikupdp,1,Atiku Abubakar,0.3,0.2,positive
35,2022-12-20 12:58:05,it easy to satisfy your cravings with our well equipped kitchenette           miracle    atiku,0,Atiku Abubakar,0.8333333333333334,0.43333333333333335,positive
36,2022-12-20 12:58:05,shemas led pdp faction to boycott atikus campaign rally inkatsina,0,Atiku Abubakar,0.0,0.0,neutral
38,2022-12-20 12:57:51,you are just making yourself happy  is going back to dubai,0,Atiku Abubakar,0.5,0.4,positive
39,2022-12-20 12:57:50,these citizens missed your memorable visits because your fulani brothers came calling,0,Atiku Abubakar,1.0,0.5,positive
40,2022-12-20 12:57:49,how atiku carry dy clean,0,Atiku Abubakar,0.7000000000000001,0.3666666666666667,positive
41,2022-12-20 12:57:35,katsina we are here to recover lokaci yayi aa,0,Atiku Abubakar,0.0,0.0,neutral
44,2022-12-20 12:57:11,just imagine  peter obi  jailed tinubu  jailed atiku  jailed  all jailed for their corruption while in government  that will be total freedom for nigerians,1,Atiku Abubakar,0.75,0.0,neutral
45,2022-12-20 12:57:02,touch down katsina by the next president of nigeria atiku abubakar,1,Atiku Abubakar,0.14444444444444446,-0.07777777777777779,negative
47,2022-12-20 12:56:29,hello katsina  be nice to my national daddy atiku abubakar   about to shutdown katsina,0,Atiku Abubakar,1.0,0.6,positive
48,2022-12-20 12:56:24,youre punished already with frustration,0,Atiku Abubakar,0.0,0.0,neutral
49,2022-12-20 12:56:22,mr president,1,Atiku Abubakar,0.0,0.0,neutral
50,2022-12-20 12:56:13,atikus time has come,0,Atiku Abubakar,0.0,0.0,neutral
51,2022-12-20 12:56:06,lmao  jokers,0,Atiku Abubakar,1.0,0.6,positive
53,2022-12-20 12:55:48,these campaigns and rallies is not for the weak and sick o no shades honestly but alhaji atiku abubakar is strong mentally and physically to have continued this movement for this long it is rare to find someone of his age bracket or even younger that can keep to it,1,Atiku Abubakar,0.5287037037037038,0.010449735449735424,positive
54,2022-12-20 12:55:47,can you imagine tinubu or atiku in peter obi position in this picturethe difference is very clear,0,Atiku Abubakar,0.4983333333333333,0.13000000000000003,positive
55,2022-12-20 12:55:39,the bag atiku abubakar will need in putting katsina votes should be made in aba because the votes will clock m votes  a strong reliable  needed,5,Atiku Abubakar,0.7333333333333333,0.4333333333333333,positive
56,2022-12-20 12:55:38,do not deceive yourself atiku couldnt win in katsina and jigawa,0,Atiku Abubakar,0.4,0.8,positive
57,2022-12-20 12:55:16,i believe in  words,0,Atiku Abubakar,0.0,0.0,neutral
58,2022-12-20 12:55:04,are on ground to  as one we can get it done lets do this together,0,Atiku Abubakar,0.0,0.0,neutral
59,2022-12-20 12:54:45,arrival of the incoming president atiku abubakar in katsina state ahead of pdp presidential campaign today,0,Atiku Abubakar,0.0,0.0,neutral
60,2022-12-20 12:54:39,surrounded pass each other lol pls list out people peter obi atiku tinubu and kwankwaso are surrounded with and lets figure out the difference,0,Atiku Abubakar,0.5375,0.3375,positive
61,2022-12-20 12:54:34,in  atiku lost katsina kebbi amp kano by more than m votes combined in this election he looks likely to flip  amp compete strongly in the rd   is showing the first step in that trio amp is a fitting end to the first leg of campaign stops,0,Atiku Abubakar,0.5666666666666668,0.32222222222222224,positive
63,2022-12-20 12:54:22,since the day obi declared his ambition to run for president theyve been looking for ways just to tack him bad till today they cant find one now your own is he was atiku running mate with dat automatically he corrupt if i say your brain sour dem go say i don too talk,0,Atiku Abubakar,0.6916666666666667,-0.18749999999999997,negative
64,2022-12-20 12:54:12,kasina turn to be liberated with the atmosphere of the pdp presidential candidates due to our normal mission to change the current bad government,0,Atiku Abubakar,0.5229166666666666,-0.16874999999999996,negative
65,2022-12-20 12:54:09,p o cant solve the issues if we look how the ipob are killings and destroying thing day by day  is the only the answer,0,Atiku Abubakar,0.5,-0.1,negative
66,2022-12-20 12:54:00,surrounded pass each other lol pls list out people peter obi atiku tinubu and kwankwaso are surrounded with and lets figure out the difference una scope no go work this time around,0,Atiku Abubakar,0.5375,0.3375,positive
67,2022-12-20 12:53:57,more about atiku  mralhatiku abubakarfmrvice president under objis an epitome of corruption  know this and know peace  that whatever choicesdecisions you makebe responsible for it,0,Atiku Abubakar,0.525,0.35,positive
68,2022-12-20 12:53:49,the stadium is getting field awaiting for the arrival of atiku  thousands are waiting outside still finding it difficult to gain entrance to the stadium  allah sarki  god is great  atiku time has come,1,Atiku Abubakar,0.6,0.10000000000000002,positive
69,2022-12-20 12:53:43,what did  say or do when the fulani terrorists massacred them why now when election cloud is gathering,0,Atiku Abubakar,0.0,0.0,neutral
70,2022-12-20 12:53:33,katsina is already in the bad for atiku and okowa,0,Atiku Abubakar,0.6666666666666666,-0.6999999999999998,negative
71,2022-12-20 12:53:31,what did  say or do when the fulani terrorists massacred them why now when election cloud is gathering,0,Atiku Abubakar,0.0,0.0,neutral
72,2022-12-20 12:53:24,kasina turn to be liberated with the atmosphere of the pdp presidential candidates due to our normal mission to change the current bad government,0,Atiku Abubakar,0.5229166666666666,-0.16874999999999996,negative
73,2022-12-20 12:53:18,atiku is next to enjoy the benefits buhari enjoyed in katsina state one million  votes for atiku in katsina  dont play,0,Atiku Abubakar,0.39999999999999997,0.3,positive
74,2022-12-20 12:53:08,is not mentally fit to be president of the federal republic of nigeria just like his friend in crime,0,Atiku Abubakar,0.4,-0.2,negative
75,2022-12-20 12:53:08,what was your response towards their question of your kith and kin killing them like chickens,0,Atiku Abubakar,0.0,0.0,neutral
76,2022-12-20 12:52:53,it high time we start mentioning name and stop seating on the fence we all know peter obi is the best man amongst these candidates for this job atiku and tinubu are not fit enough we all know the both of them are birds of same feather,0,Atiku Abubakar,0.37299999999999994,0.192,positive
77,2022-12-20 12:52:49,atikulated  the unifier  atiku is coming no doubt,0,Atiku Abubakar,0.0,0.0,neutral
78,2022-12-20 12:52:37,sorry o despite ur patronage ull not be recognized talk less of being accommodated in god forbid atiku presidency,0,Atiku Abubakar,0.5333333333333333,-0.3333333333333333,negative
79,2022-12-20 12:52:35,there no how atiku could defend all the properties within his possession without being found guilty of money laundering just like other aspirants  i place much value and respect on you than all these cheap comments of yours,0,Atiku Abubakar,0.56875,-0.006249999999999992,negative
80,2022-12-20 12:52:29,the reason  is promising them presidency in the future is because nd niger bridge has left the realms of promises but now a reality under  pdp scamming since,1,Atiku Abubakar,0.20833333333333334,0.06666666666666667,positive
81,2022-12-20 12:52:29,i laugh you and atiku,0,Atiku Abubakar,0.1,0.3,positive
82,2022-12-20 12:52:23,desperate because he is trying for the first time to contest as president can u tell us how many times atiku has contested your answer would be enough definition for desperate  nor come d yarn nonsense here,0,Atiku Abubakar,0.5888888888888889,-0.09166666666666666,negative
85,2022-12-20 12:52:16,yeah punish her for all d times that the lady rejected his advance eg just like buhari see where we are today atiku abubakar regime will be a child play compare to buhari expect cattle colony ruga grazing bill water bill etc i pity those morons that are campaigning for aa,3,Atiku Abubakar,0.6,-0.45,negative
87,2022-12-20 12:52:10,he a crude oil thief  has been accused by obj in a document that not been challenged to be the greatest criminal of all times in nigeria you a supporter of atiku has been shown to be an identity thief you refused to go to court to clear your name,0,Atiku Abubakar,0.7333333333333333,1.0408340855860843e-17,positive
88,2022-12-20 12:51:41,why not,0,Atiku Abubakar,0.0,0.0,neutral
90,2022-12-20 12:50:34,stop deceiving atiku you know that he wont win,0,Atiku Abubakar,0.4,0.8,positive
92,2022-12-20 12:50:21,please my po dont have this kind of belle if you draw atiku and tinubu what kind of belle you go put,0,Atiku Abubakar,0.9,0.6,positive
93,2022-12-20 12:49:51,to all my obidient folks to avoid heart attack please dont open  see people tropping into the stadium in katsina for  as if its  finals   to the rescue for nigerians,1,Atiku Abubakar,0.5,0.0,neutral
96,2022-12-20 12:49:20,thank god you said lots of pdp people peter  obi was in pdp as at march dis year not just an ordinary member but a vice presidential candidate to atiku do the maths,0,Atiku Abubakar,0.5,-0.25,negative
97,2022-12-20 12:49:10,best way to catch thieves is to put another thief in charge nd pay him higherover to you  reno is atiku a thief,0,Atiku Abubakar,0.3,1.0,positive
98,2022-12-20 12:49:02,any leader will fail if unable to turn  into a manufacturing amp an industrialized economy whereby our total dependency on white men will end atiku cant,0,Atiku Abubakar,0.38749999999999996,-0.25,negative
101,2022-12-20 12:48:26,stop making your followers loose confidence in you through your choice of candidate now the image im seeing in you is dignity humanity and respect this your post is belittling the picture people placed on you  there no how atiku could defend all the properties within his,0,Atiku Abubakar,0.2692307692307692,-0.07692307692307693,negative
102,2022-12-20 12:48:24,its wise political move from atiku however i think  is behind schedule to visit them they are his strong hold in kaduna and he should have visited them all these while,0,Atiku Abubakar,0.6083333333333333,0.1833333333333333,positive
103,2022-12-20 12:48:13,katsina is showing out for  bigly we will,2,Atiku Abubakar,0.1,0.0,neutral
104,2022-12-20 12:48:08,onoh to atiku keep your greek gift for south east,0,Atiku Abubakar,0.0,0.0,neutral
106,2022-12-20 12:47:40,atiku is the right answer,0,Atiku Abubakar,0.5357142857142857,0.2857142857142857,positive
107,2022-12-20 12:47:40,the presidential candidate of the peoples democratic party pdp in next years general elections    has assured the people of southern kaduna of curbing the lifelong insecurity that has bedeviled the area if elected,1,Atiku Abubakar,0.275,-0.012499999999999997,negative
109,2022-12-20 12:47:28,with god nothing shall be impossible so i concur atiku will have a nationwide victory across the  states of the federation including abuja fct,0,Atiku Abubakar,1.0,-0.6666666666666666,negative
110,2022-12-20 12:47:28,watin dey vex me pass be sey nah when person dey see una be this after election una go dey travel out  best hotel no dey nigeria for una side  youth are lazy and una still want make lazy youth vote una one liter of petrol go con turn naira  useless country,1,Atiku Abubakar,0.625,0.0,neutral
111,2022-12-20 12:47:11,atiku is out of the race five of his party governors are now with peter obi you cant take a slot meant for the south a fulani man cant succeed another fulani the governors have shown how to treat an arrogant selfish and inconsiderate person like atiku,0,Atiku Abubakar,1.0,-0.5,negative
113,2022-12-20 12:46:53,what say you sir is it just vote hustle season or youve not been notified,0,Atiku Abubakar,0.0,0.0,neutral
114,2022-12-20 12:46:46,senior man h e mr peter obi the king of trends is still topping the trends table till nw he is in akwa ibom state  consultation and presidential rally he ll defeat atiku and tinubu  be d next president agbado boys and mikanists can nw cry i need ur tears seriously,1,Atiku Abubakar,0.3333333333333333,-0.16666666666666666,negative
115,2022-12-20 12:46:10,ur  is a renown thief a whole page was dedicated in my watch by obasanjo to explicitly stated his stealing his fraud is one of the reason why he cant travel uk on his own atiku is a dangerous cankerworm to national asset and we say no to a conventional thief,1,Atiku Abubakar,0.6642857142857143,0.014285714285714304,positive
116,2022-12-20 12:46:03,like tinubu and atiku abi yes oh god has already exposed them and you  trying to maintain status quo so that you will continue to thrive while the rest of nigeria suffers mba god has already answered continue to fight god,0,Atiku Abubakar,0.7,-0.6,negative
117,2022-12-20 12:45:41,thought to go easy on him,0,Atiku Abubakar,0.8333333333333334,0.43333333333333335,positive
119,2022-12-20 12:45:25,if the inec  and the cabals refuse to allow the people choice of candidate in the person of peter obi to become the president of this collapse country callednigeria  then we will embark on revolution  tinubu atiku get ready to run,0,Atiku Abubakar,0.5,0.2,positive
120,2022-12-20 12:45:10,welcome to   katsina stete,2,Atiku Abubakar,0.9,0.8,positive
121,2022-12-20 12:45:09,breaking news   katsina karkkanda stadium more than half of it empty as   presidential candidate visit katsina  source,3,Atiku Abubakar,0.38888888888888884,0.07777777777777779,positive
122,2022-12-20 12:45:01,our message is simple and clear nigeria next president  is ready and prepared to     is forming the next government,1,Atiku Abubakar,0.2480952380952381,0.06000000000000001,positive
124,2022-12-20 12:44:50,this has never been about a debate not being his forte in what world is buhari or atiku a better debater than tinubu a first class university graduate what am i missing here the more these attempts to defend his absence the more ridiculous you all sound,0,Atiku Abubakar,0.41041666666666665,0.20052083333333337,positive
125,2022-12-20 12:44:40,election is around the corner  suddenly remembers the importance of votes from skaduna where was  when the fulani terrorists massacred the people of skaduna when late obadiah malafia cried out what did  say or do skaduna be wise,0,Atiku Abubakar,0.6666666666666666,0.13333333333333333,positive
126,2022-12-20 12:44:31,atiku is the next president of nigerians residing in dubai insha allah,0,Atiku Abubakar,0.0,0.0,neutral
128,2022-12-20 12:44:29,if shekarau delivers his ward mundubawa to atiku just declare him winner,0,Atiku Abubakar,0.0,0.0,neutral
129,2022-12-20 12:44:27,election is around the corner  suddenly remembers the importance of votes from skaduna where was  when the fulani terrorists massacred the people of skaduna when late obadiah malafia cried out what did  say or do skaduna be wise,0,Atiku Abubakar,0.6666666666666666,0.13333333333333333,positive
130,2022-12-20 12:44:01,the love and support for his excellency atiku abubakar is massive  the people of katsina state are coming in their thousands in support of the recovery process indeed katsina state is pdp,1,Atiku Abubakar,0.8,0.25,positive
131,2022-12-20 12:43:52,the gods are not asleep atiku in chatham house,0,Atiku Abubakar,0.0,0.0,neutral
132,2022-12-20 12:43:45,vote atiku pdp youre the most sane human being on earth atiku is the only qualified and the most competent man in the race he is over ready to rescue nigeria and with atiku we will,1,Atiku Abubakar,0.5444444444444444,0.2833333333333333,positive
133,2022-12-20 12:43:39,katsina we are here and we are ready to rescue nigeria from the present administration together we all can get this done,0,Atiku Abubakar,0.25,0.1,positive
134,2022-12-20 12:43:38,movement,0,Atiku Abubakar,0.0,0.0,neutral
135,2022-12-20 12:43:36,what wrong with his house fool,0,Atiku Abubakar,0.9,-0.5,negative
136,2022-12-20 12:43:30,touchdown katsina the pdp presidential candidate he alhaji atiku abubakar has just arrived katsina state for a presidential mega rally ahead of the  general election,1,Atiku Abubakar,0.5,0.05000000000000002,positive
137,2022-12-20 12:43:24,mikano boys keep whining and crying  on po candidacy  while supporting bigoted atiku the corrupt and infamous expert in national asset looting  atiku will lose woefully again the x since,0,Atiku Abubakar,0.7125,-0.2375,negative
138,2022-12-20 12:43:21,d like you dey talk about waste what have you done with your whole life wasted egg,0,Atiku Abubakar,0.13333333333333333,-0.06666666666666667,negative
139,2022-12-20 12:43:14,yes that mental issue in your father family is about to destroy your marriage r fulani,0,Atiku Abubakar,0.1,-0.15000000000000002,negative
141,2022-12-20 12:43:06,remove the log before obsessing on our speck aisha is very much against doyin check your facts first then find something on po  like there are on tinubu and atiku,0,Atiku Abubakar,0.29666666666666663,0.255,positive
142,2022-12-20 12:43:03,is not the right choice either nigerians earnestly wants,0,Atiku Abubakar,0.31785714285714284,0.24285714285714285,positive
143,2022-12-20 12:43:02,seyi is under serious threat go against atiku amp we will go against your governship seat oyo pdp  thank god presidential election will come first amp for the followers ortom have election okeize have election the same date with atiku  politics isnt your mate,2,Atiku Abubakar,0.375,-0.027777777777777773,negative
144,2022-12-20 12:43:00,very fraudulent,0,Atiku Abubakar,0.3,0.2,positive
145,2022-12-20 12:42:53,yes ooo we move,0,Atiku Abubakar,0.0,0.0,neutral
147,2022-12-20 12:42:37,atiku is the best man for the job the unifier is coming,0,Atiku Abubakar,0.3,1.0,positive
148,2022-12-20 12:42:21,talking to a biz associate from katsina apc member earlier this morning reminding him that our principal is in their town  shockingly he said in hausa that certainly atiku will win because people of katsina dont want apc anymore,0,Atiku Abubakar,0.6178571428571428,0.0035714285714285865,positive
149,2022-12-20 12:42:20,the greatest joke of the year,0,Atiku Abubakar,1.0,1.0,positive
150,2022-12-20 12:42:17,let put money na so you can put your money where your mouth is asiwaju will beat atiku mercilessly in katsina  i have a k to bet,0,Atiku Abubakar,1.0,-0.7,negative
151,2022-12-20 12:42:08,you are sick and mad,0,Atiku Abubakar,0.9285714285714286,-0.6696428571428572,negative
153,2022-12-20 12:42:02,all these dump heads saying sai baba in  sai baba was all over the place here we are today nigeria   is impoverished than he met her  sai baba back to senders,0,Atiku Abubakar,0.0,0.0,neutral
154,2022-12-20 12:41:59,he atiku abubakar and his recovery team paid a courtesy visit to the emir of katsina state,2,Atiku Abubakar,0.0,0.0,neutral
155,2022-12-20 12:41:36,atiku is the answer,0,Atiku Abubakar,0.0,0.0,neutral
156,2022-12-20 12:41:29,even the once with money still dies na why buhari tinubu and atiku run go abroad for medical,0,Atiku Abubakar,0.0,0.0,neutral
157,2022-12-20 12:41:28,your mumu na type c charger e big pass others,0,Atiku Abubakar,0.1,0.0,neutral
159,2022-12-20 12:41:21,your father can step down for atiku not obi,0,Atiku Abubakar,0.2888888888888889,-0.15555555555555559,negative
160,2022-12-20 12:41:15,some state hv their area of specializatn eg importation of trucks and heavy duty parts are mostly done by pple in ibadan wt long time experience in itshadabrocadeatiku fabric are heavily imported in kano and hence it most time cheaper in kano duty also play big role,0,Atiku Abubakar,0.4166666666666667,0.09166666666666667,positive
162,2022-12-20 12:40:59,are you ready to go on exile if he wins,0,Atiku Abubakar,0.35,0.25,positive
163,2022-12-20 12:40:59,nobody is against tilumbu or atinku because they have few questionable individuals around them no tilumbu and atiku are the questionable individuals themselves okupe is not on the ballot tilumbu is atiku is obi is we are voting a candidate without a fraud baggage,1,Atiku Abubakar,0.7000000000000001,-0.39999999999999997,negative
164,2022-12-20 12:40:53,you and i know atiku aint clean,0,Atiku Abubakar,0.7000000000000001,0.3666666666666667,positive
165,2022-12-20 12:40:47,nice one since we are at iltsking down thieves lets start with the big ones not small fries nahlets go tinubu atiku mallami gandoje accountant general ffk dem plenty which one what is good enough for yhe goose is good enough for the gander,0,Atiku Abubakar,0.49876543209876545,0.2243827160493827,positive
166,2022-12-20 12:40:36,he atiku abubakar and his recovery team paid a courtesy visit to the emir of katsina state,2,Atiku Abubakar,0.0,0.0,neutral
167,2022-12-20 12:40:28,brown envelop network,0,Atiku Abubakar,0.0,0.0,neutral
168,2022-12-20 12:40:22,na you dey sick,0,Atiku Abubakar,0.8571428571428571,-0.7142857142857143,negative
170,2022-12-20 12:40:07,atiku is winning,0,Atiku Abubakar,0.75,0.5,positive
171,2022-12-20 12:40:04,let us recover katsina with  and  two great leaders that will transform and recover nigeria,0,Atiku Abubakar,0.75,0.8,positive
172,2022-12-20 12:39:40,why should you use artist name to pull crowd is that not desperation or lemme say fraudulent act,0,Atiku Abubakar,0.0,0.0,neutral
173,2022-12-20 12:39:39,the atikuokowa recovery team have respect for our traditional rulers that why everywhere they go they always recognized the facts that our traditional institutions have vital roles to play in the rescuing and recovery mission come,0,Atiku Abubakar,0.6333333333333333,0.03333333333333333,positive
174,2022-12-20 12:39:33,he couldnt even read a written document having atiku as a candidate is a disgrace to our great nation you even ran to reset his mumu bottom so sad,0,Atiku Abubakar,0.875,0.15000000000000002,positive
175,2022-12-20 12:39:31,this must be the reason why the man has been contesting since  without success he always has deceivers and liars managing his campaigns the zone has a more competent and trust worthy son peter obi in the race atiku will lose in the south east,0,Atiku Abubakar,0.5416666666666666,0.4083333333333333,positive
176,2022-12-20 12:39:31,only atiku is clean,0,Atiku Abubakar,0.8500000000000001,0.18333333333333335,positive
177,2022-12-20 12:39:21,atiku will win the  election in february katsina is atikulated,2,Atiku Abubakar,0.4,0.8,positive
178,2022-12-20 12:39:19,some pdp clowns here said some months back that po will step down for atiku latest by december   december will end next week yet po is growing stronger covering more grounds clowns,0,Atiku Abubakar,0.3377777777777778,0.1688888888888889,positive
179,2022-12-20 12:39:18,katsina we are here  the recovery team has landed,0,Atiku Abubakar,0.0,0.0,neutral
180,2022-12-20 12:39:17,you will never have sense,0,Atiku Abubakar,0.0,0.0,neutral
181,2022-12-20 12:39:11,you cant buy grace nor can you hurry love  the rock is beloved the rock is full of grace  alhamdulillah  may god bless the federal republic of nigeria  and  if you vote pdapctinubuatiku  instead of  years itll take the north  years to catch up the south,0,Atiku Abubakar,0.7166666666666668,0.5166666666666666,positive
