,date,tweet,nlikes,Candidate,Subjectivity,Polarity,Analysis
410,2022-12-16 16:00:02,one minute podcast  the poor are hungry and they will push back against a cruel and uncaring society  link,0,Peter Obi,0.5333333333333333,-0.4666666666666666,negative
411,2022-12-16 15:57:20,and obidients will massively hijack the money to influence,0,Peter Obi,1.0,0.0,neutral
412,2022-12-16 15:55:06,be happy it is a season of happiness and we are taking back our country,0,Peter Obi,0.39999999999999997,0.5,positive
413,2022-12-16 15:54:00,the one person that will win this election is the person that didnt bribe his way for party flagbearer justice and equity is our watchward vote wisely,0,Peter Obi,0.65,0.75,positive
414,2022-12-16 15:53:51,i tire o after the election una eye go clear po will return to pdpall obidients will fall in line and back to status quo,1,Peter Obi,0.19166666666666665,0.05000000000000001,positive
415,2022-12-16 15:52:54,na only nonsense una wey be obidients sabi talk  like do you people even say anything aside nonsense,0,Peter Obi,1.0,0.0,neutral
416,2022-12-16 15:52:14,this is not a motional quote  go and verify dear,0,Peter Obi,0.0,0.0,neutral
417,2022-12-16 15:52:04,yet obidients think otherwise david is with the wrong folks,0,Peter Obi,0.9,-0.5,negative
418,2022-12-16 15:50:13,currently sitting pretty at  thousand naira a dear bag of rice is off limit for an average nigerian  it not a regional tribal or religious affliction it a national problem  so when next you make your assessment take away the bias,0,Peter Obi,0.41,0.02,positive
419,2022-12-16 15:48:22,update from pvc collection center jokes on you bro you will hear from obidients in february,1,Peter Obi,0.1,-0.1,negative
420,2022-12-16 15:48:20,dont be distracted by side talks please dont live the polling until the inec staff upload the results before going to the collection center  obidients we can go with our wifi banks we must vote and stay everybody is lp polling agent please let shine out eyes vote and stay,1,Peter Obi,0.3,0.018181818181818174,positive
421,2022-12-16 15:48:15,yes oh whatever it takes i saw plenty obidients collecting theirs too see the joy on their faces    one was literally kissing his pvc,2,Peter Obi,0.2,0.8,positive
422,2022-12-16 15:46:43,vote for our candidate  like if peter obi will rule only obidients once he wins oga are you ok,0,Peter Obi,0.5666666666666667,0.26666666666666666,positive
425,2022-12-16 15:43:46,i stopped responding to the goat a long time ago we must try to restrain ourselves from responding to his tweets or anyone camping with those who wish to keep their knees on our necks as obidients  make them irrelevant by not responding then they will simply fade away,3,Peter Obi,0.5857142857142857,-0.18333333333333335,negative
426,2022-12-16 15:41:32,peter obi the head ache of many but the joy of obidients,0,Peter Obi,0.35,0.65,positive
427,2022-12-16 15:40:37,that noted now pay  and keep to your lane,2,Peter Obi,0.0,0.0,neutral
428,2022-12-16 15:38:37,man this evil deadly people aint joking  those leaked videos and many more aint playthey want to fight dirty and theyve started     a time will come citizens amp let me just say obidients will not have to sit down and look and fold our hands     i pray we dont get to dt,2,Peter Obi,0.5814814814814815,-0.15925925925925924,negative
429,2022-12-16 15:37:32,pls remove wike and u will understand after he leaves office next year he is a bloodthirsty tyrant who settles the media just to look away from his atrocities except when commissioning a flyover obidients and batists love him cos he is anti atiku but we are just being played,0,Peter Obi,0.5,0.0,neutral
430,2022-12-16 15:37:30,are asking for polls to be done by an independent body to determine where we stand amp what areas need to be focused on is this something that can be done,0,Peter Obi,0.125,0.0,neutral
431,2022-12-16 15:35:18,obidients leave this cloutchaser oooo why is it so difficult for goodness sakes,0,Peter Obi,1.0,-0.5,negative
432,2022-12-16 15:31:46,a yrs old artist david pepple nengi who calls himself the the teens ambassador for peter obi  campaign has drawn a beautiful portrait of mr peter obi,0,Peter Obi,0.6,0.475,positive
433,2022-12-16 15:31:19,thanks qudus for visiting my town i will ask fellow obidients to work on your advice,0,Peter Obi,0.2,0.2,positive
434,2022-12-16 15:28:35,hahaha obidients and vawulence are like sugar and tea,1,Peter Obi,0.4,0.2,positive
435,2022-12-16 15:27:03,i fight obidients but not killing i wont accpt that no blood is enough for political gains we most get up and reject this cuz it can be anybody tomorrow,1,Peter Obi,0.3666666666666667,0.16666666666666666,positive
436,2022-12-16 15:26:23,dear  thanks for dedicating your platform towards obidient movement supporting h e  for a better and working nigeria we really appreciate you obidients please let follow them and appreciate them for identifying with us,84,Peter Obi,0.2875,0.2875,positive
437,2022-12-16 15:25:16,everyday i recreate and upload amazing exciting and insightful videos if you like this video it takes only  secs to go to my profile and hit the follow button do it now obidients,21,Peter Obi,0.825,0.17500000000000002,positive
439,2022-12-16 15:23:35,his best is our best  amp we wish him that as well as  and thats why we will continue to do our best   nothing less of that,0,Peter Obi,0.24166666666666664,0.7083333333333334,positive
440,2022-12-16 15:23:07,the policy of obidients they strongly believe he has the magic wand to transform nigeria despite the facts on ground theyre not dissuaded by his emptiness amp lack of ideas they dont care about his church nomadism  that actually an admirable trait if you ask me,0,Peter Obi,0.6111111111111112,0.3111111111111111,positive
441,2022-12-16 15:22:51,you are truly a shameless con man you have some people cheering you now but very soon you will realize you are all alone and the full shame will stair at your face very soon man very soon,2,Peter Obi,0.36250000000000004,0.2375,positive
442,2022-12-16 15:22:26,leave him this abuja that you want to talk to someone about obi the person is already convincing you to vote obi and all of youll end up shouting obidients,6,Peter Obi,1.0,0.5,positive
443,2022-12-16 15:21:45,theyve left u behind mrktin amp banta stage don pass since nah amp obidients won in all platforms wit little effort cos bat made it so easy for us he no dey disappoint we r now at the stage of practical politics amp you r doing backward tin here currently the odds are against bat,1,Peter Obi,0.48666666666666664,-0.030833333333333334,negative
444,2022-12-16 15:18:49,a good guy unfortunately it nt d turn of d north the presidency must go back to the south after buhari yrs that why atiku shouldnt be seen as a serious contender back to d south we all know it d turn of d south east for justice n equity that y were obidients,0,Peter Obi,0.4533333333333333,-0.026666666666666672,negative
445,2022-12-16 15:17:43,finally i don collect my pvcnow noise don start,3,Peter Obi,1.0,0.0,neutral
446,2022-12-16 15:16:04,obidients just love hearing the statement  it a three horse race even though kogi people don kill the rd horse,26,Peter Obi,0.6,0.5,positive
447,2022-12-16 15:15:08,i thought they said obidients are the most unruly set of humans on earth the venom these batist are spewing against a well wish can kill even the bronze serpent itself,0,Peter Obi,0.5,0.5,positive
448,2022-12-16 15:15:00,yes naa u know unlike their norm for you to argue with most obidients u must have something inside ur head hence any small thing they say you are obidient then you must be toxic oga sadiq drop ur logical points make we promote knowledge no be everytime cruise,3,Peter Obi,0.3833333333333333,0.16666666666666666,positive
449,2022-12-16 15:12:36,the intimidation towards the  is enormous but  tantrums got nothing on the delta people conviction of peter obi,9,Peter Obi,0.9,0.0,neutral
450,2022-12-16 15:10:40,but tinubu has been stealing all his life to the extent that even lagos state treasury is in him pocket but people like you who survives from his crumbs has no problem with that obidients does not and will never condole any form of stealing,0,Peter Obi,0.0,0.0,neutral
451,2022-12-16 15:04:04,this my obidients go answer obi ownanswer atiku ownanswer sowore ownuna blood dey hot ooo,2,Peter Obi,0.8500000000000001,0.25,positive
452,2022-12-16 15:03:31,peter obi is a scammer i dont understand how the ethnic amp religious bigots obidients cannot see through this man it is immoral for any governor to invest taxpayers money in his family business but obi has brainwashed the obidients that what he did was good amp they believed,0,Peter Obi,0.42500000000000004,0.35,positive
453,2022-12-16 14:59:51,thought they said obidients are tired,0,Peter Obi,0.7,-0.4,negative
454,2022-12-16 14:55:16,akwa ibom  peter obi is coming obidients are you ready lets shutdown uyo for peter obi will win vote peter obi vote lp,206,Peter Obi,0.45,0.5,positive
455,2022-12-16 14:54:58,una go see grassroots campaign like never before in this country  obidients are taking this very personal,18,Peter Obi,0.39,0.0,neutral
456,2022-12-16 14:52:44,he subliminally ran a poll with those tweets  the streets and twitter have spokenthe masses are aggressively voting for po  he will win this election with a landslide   keep working obidientsconvert more souls for our future depends on it,48,Peter Obi,0.3416666666666666,0.43333333333333335,positive
457,2022-12-16 14:52:01,if they like let them give order to remove stickers on cars and keke the truth is that the obidients message is contagious it is rooted in the heart if they can take away the remembrance of poverty and hard life in this country then the removal of sticker order will work,2,Peter Obi,0.5416666666666666,-0.2916666666666667,negative
458,2022-12-16 14:50:27,you can add me to the call  to fight war don dey hungry me,2,Peter Obi,0.0,0.0,neutral
459,2022-12-16 14:48:07,obidients are the happiest,0,Peter Obi,0.0,0.0,neutral
460,2022-12-16 14:45:43,but its obidients that are abusive and insult people no lp spokeperson has ever used such vile abusive words to describe other candidates only the dg of tinubu pcc media arm will spill such unwarranted words against other candidates such a shame,1,Peter Obi,0.5416666666666666,-0.041666666666666664,negative
461,2022-12-16 14:43:31,monetary inducement is what gives apc arrogant courage that theyll win  election tinubu had called on his groundsmen to snatch and run with power at all cost obidients shouldnt cower light prevails over darkness money will fail them po wins,1,Peter Obi,0.39999999999999997,0.25000000000000006,positive
462,2022-12-16 14:43:21,you are not an obidients the people on the internet are humans it will shock you people,0,Peter Obi,0.0,0.0,neutral
463,2022-12-16 14:42:55,dear obidients it less than  months to election day amp i have some questions   do u have oe have u collected ur peter voter card  does everyone in ur community know about peter obi and the lp logo  dont forget the only way peter obi can win is if we all play our part,73,Peter Obi,0.48888888888888893,0.21111111111111114,positive
464,2022-12-16 14:37:35,delta obidients please jump on this poll and do the needful let show these guys who boss,0,Peter Obi,0.0,0.0,neutral
465,2022-12-16 14:37:32,benue obidients  gbokotarka federal constituency african democratic congress adc thank you,0,Peter Obi,0.0,0.0,neutral
466,2022-12-16 14:32:29,i completely agree with ur analysis safe states for bat re shaky though the north re really reconsidering voting for another sick man n another inept leader thus i think most of bat safe states might end up as swing states for either rmk or po,3,Peter Obi,0.49387755102040815,0.10748299319727891,positive
467,2022-12-16 14:31:32,see how love for obi is clocking  the comment section is hitting k if obi does not win eh then  of obidients will enter politics then the rest apply for any inec post we must right the wrong seriously,0,Peter Obi,0.6204761904761904,-0.08952380952380953,negative
468,2022-12-16 14:28:45,a good chance for obidients unfortunately the  couldnt be won how i wish this chance goes for batists primary school pupil na them go win am,0,Peter Obi,0.625,0.35,positive
469,2022-12-16 14:27:51,obi  dobidients camp welcomed this  kwankwaso  dkwankwasias welcomed it too  even atiku  datikulates  but tinubu  dbatists camp are tumbling over selves rufai this rufai that  evil people runneth when no one pursued,0,Peter Obi,1.0,-1.0,negative
471,2022-12-16 14:27:39,twimc those seeking to direct command or control  should please take note you have a dysfunctional bureaucratic rigid ineffective inefficient stubbory corrupt old order to contend with face them and leave the youth alone your hands should already be full,0,Peter Obi,0.5375,0.012499999999999983,positive
472,2022-12-16 14:23:48,i finally collected my pvc today after so many years of unsuccessful effort to get it ladies and gentlemen see you at the polling unit,1,Peter Obi,0.75,0.25,positive
473,2022-12-16 14:23:11,dont even think of contemplating on deleting results from the saver and replace it with your frivolous one because were m time ahead of that rubbish plans,2,Peter Obi,0.0,0.0,neutral
474,2022-12-16 14:22:08,ndi ara efulefu you obidients especially from th south east are a pathetic lot god punish your imbecile of a father and your whoring mother,0,Peter Obi,1.0,-0.6,negative
475,2022-12-16 14:20:48,your hopping to rig through inec saver your too small for tech bring it on rubbish  you people will learn the most dangerous and bitter lessons come next year,1,Peter Obi,0.45999999999999996,-0.09,negative
476,2022-12-16 14:20:34,so anybody supporting tinubu is mad this is democracy and everyone has a right to a choice you obidients lots are just militantanyway  is just around the corner you will see how many of us are mad when we exercise our rights,0,Peter Obi,0.6571428571428571,-0.04285714285714286,negative
477,2022-12-16 14:18:03,you don deh call im papa now after una go talk say obidients are cyber bullies,1,Peter Obi,0.0,0.0,neutral
478,2022-12-16 14:17:22,its all about money obi refused to pay him as social media coordinator and now obidients have made him irelevant in the social media space and atiku is not ready to pay him as much as he was expecting reserve some pity for reno,0,Peter Obi,0.20666666666666664,0.013333333333333336,positive
479,2022-12-16 14:16:53,delta state is for peter obi because the obidients are everywhere in the place delta is in the bag for labour party,0,Peter Obi,0.0,0.0,neutral
480,2022-12-16 14:15:50,history has it that the best football players do not end up being the best  football coaches   my advice to sowore is to go and start from his state because charity they say begins at home when he becomes serious obidients will support him to be the governor of his state,1,Peter Obi,0.4222222222222222,0.5555555555555556,positive
481,2022-12-16 14:14:27,yet it obidients who are being maligned as purveyors of violence smh,2,Peter Obi,0.0,0.0,neutral
482,2022-12-16 14:13:08,where are my obidients brothers  and   how are you guys doing,4,Peter Obi,0.0,0.0,neutral
483,2022-12-16 14:04:59,this is for us,2,Peter Obi,0.0,0.0,neutral
484,2022-12-16 14:04:42,be patient do your thing amp stay on it your turn will come,1,Peter Obi,0.0,0.0,neutral
485,2022-12-16 14:01:24,i see obidients only here no deceive yourself o,0,Peter Obi,1.0,0.0,neutral
486,2022-12-16 13:59:08,we know them they are apc remember earlier ipob have been warning that apc would assassinate people in the east just to blackmail ipob and obidients the other day it was an apc member they shot just to deter obidients more are coming apc are terrorists,0,Peter Obi,0.4583333333333333,0.125,positive
487,2022-12-16 13:57:47,my organization is closing for the year todayits been a busy and grateful year  certifications   promotion  pay raise   new apartment  relationship   ill be pouring my aggression on obidients going forward since ive got a free time on my hands now,0,Peter Obi,0.6386363636363637,0.03409090909090909,positive
488,2022-12-16 13:57:39,grassroots evangelism in remote lagos obidients went there to preach peter obi and they are now obidient with pvcs po is coming   anambra nd niger bridge obi of onitsha the  presidency hand of god gangs of london  toke oba of benin runtown adeleke dorcas frodd,8,Peter Obi,0.2,-0.1,negative
489,2022-12-16 13:56:53,exactly the point with your k followers how many engagement do you get   mention obidients for engagement and that what you are getting  show where you were bullied for being neutral,3,Peter Obi,0.375,0.375,positive
490,2022-12-16 13:53:33,obidients can drag me till all my body is bloody but i will keep calling it strategically as i deem fit since i want nothing but a better nigeria lets stop whining about  pcc or  and their lack of attention to us we rocked without them before keep moving,52,Peter Obi,0.46770833333333334,0.0,neutral
491,2022-12-16 13:52:27,owerri no dey carry last,0,Peter Obi,0.06666666666666667,0.0,neutral
492,2022-12-16 13:49:56,i hope now  wont liken  to nazi and all those media houses wont call them violent or bullies again we know who the bullies are,1,Peter Obi,1.0,-0.8,negative
493,2022-12-16 13:47:35,dear oyin im very much sure dat obidients are doing anytin possible to reach d rural vote blocs that ur state or town hasnt gotten enough of the heat dsnt mean we are not trying if there little you can do to foster the reach u can also help us,1,Peter Obi,0.5960648148148148,0.0,neutral
494,2022-12-16 13:47:30,exactly lets keep doing that and supporting the obidients campaign org when announced by some of the national leaders like  and  and other top leaders  then keep it simple kiss is the way to go in my opinion instead of whining about pcc or,4,Peter Obi,0.3464285714285714,0.175,positive
495,2022-12-16 13:45:22,if this truth doesnt scare you enough to make the right decisions n take the rights steps in  then you are part of the problem,74,Peter Obi,0.5178571428571428,0.14285714285714285,positive
496,2022-12-16 13:45:00,well we all knew  was not ready  months ago but formed support groups anyway so why cry now we must self organize under an obidients campaign org that  and  and co are doing they will announce soon amp stop looking to those who didnt hire us,1,Peter Obi,0.5,-0.1,negative
497,2022-12-16 13:43:13,wahala uncle temisan dey give the obidients steadily,0,Peter Obi,0.5,0.16666666666666666,positive
498,2022-12-16 13:40:14,you always talk senseless you wan form solomon,0,Peter Obi,0.15000000000000002,-0.2,negative
499,2022-12-16 13:39:15,ive been watching how youve assisted the obidients movement for months   stand strong oyinda   the bright future you envision for you and your daughter will come to fruition,2,Peter Obi,0.5527777777777777,0.37777777777777777,positive
500,2022-12-16 13:39:13,i will say it again obidients are not politicians it takes billions to run even a noshishi campaign lets drop the no campaign materials drama lets use kiss keep it simple stupid strategy for   form small cells bond weekly get pvc vote amp defend,431,Peter Obi,0.5857142857142857,-0.3499999999999999,negative
501,2022-12-16 13:37:34,peter obi  it scalding friday  give them something to take home twitter on fire    no be unah mate i doff cap aye captains,1,Peter Obi,0.0,0.0,neutral
502,2022-12-16 13:34:47,keep wailing the wails obidients whatsapp room told you to wail here,0,Peter Obi,0.0,0.0,neutral
503,2022-12-16 13:32:30,hello obidients  we found the man and did a phone interview with him   he even debunked the lie of elrufia saying po asked hausas to carry id cards  we will be getting him on air to tell his story soon  we need your supports to push this story on different media platforms,53,Peter Obi,0.6,0.0,neutral
504,2022-12-16 13:31:21,if obidients dont go under that ffk tweet where he called datti the daft to reign abuse and insults on him i wont take them seriously on this street again i expect the global hq of obidient vawulence unit to descend on ffk now that totally unacceptable,0,Peter Obi,0.47222222222222215,-0.1111111111111111,negative
505,2022-12-16 13:28:19,an idiot chooses inlaw over his own brother heew,0,Peter Obi,0.9,-0.10000000000000003,negative
506,2022-12-16 13:25:35,moved from first  frame to the last framewithin just a semester  ondo sun fine art department and shege you do this one to bring more joyful experience  things are going to be better soon,2,Peter Obi,0.38,0.33333333333333337,positive
507,2022-12-16 13:25:28,stop all these get your p vc and convert more soulsthere are lots of yorubas and housa fulani supporting ibo candidatethis is nigeria stop being naive politics is not an emotional gamelets get in the mud with them obidients or we all regret it,0,Peter Obi,0.6,0.1125,positive
508,2022-12-16 13:24:44,the pain has been dwelling in your home endlessly that why you are having sleepless nights over obidients that dont have structure  kindly do well to shield that innocent baby on your twitter avi from the balablu abi na babablu that baby is too innocent to be unfortunate,0,Peter Obi,0.8099999999999999,0.195,positive
510,2022-12-16 13:23:17,he should go offline and see obidients collecting their pvcs and mobilizing people offline,2,Peter Obi,0.0,0.0,neutral
511,2022-12-16 13:23:08,ozuah the truth just leaked cheaper,0,Peter Obi,0.0,0.0,neutral
512,2022-12-16 13:22:21,if only likes can buy bread o,1,Peter Obi,1.0,0.0,neutral
513,2022-12-16 13:21:47,my beloved  have you tweeted about   today  lets leave no stone unturned o our country is no longer serving us o we need to fix it    bvas  pvc peter obi seyi abati,13,Peter Obi,1.0,0.7,positive
514,2022-12-16 13:21:19,same thing goes for you obi has no structure obidients are  people tweeting from one room yet apc minions keep suffering insomnia because of a structureless candidate,0,Peter Obi,0.125,0.0,neutral
0,2022-12-17 00:40:10,if we are not careful bat will win the  election the old strategy still works and hes vigorously putting it into use i was in african shopping mall today in canada it was all bat on tv back to back,0,Bola Ahmed Tinubu,0.26666666666666666,0.15833333333333335,positive
2,2022-12-17 00:40:05,stk nd xi v muni muni   melbourne university have won the toss and elected to bat,0,Bola Ahmed Tinubu,0.0,0.0,neutral
6,2022-12-17 00:39:55,you see one thing i have noticed about you you choose party over national progress everything apc is good to you i will vote sawolu but never for bat evan as a card carrier member of apc because nation above party i want young amp innovative minds but you choose anything apc,0,Bola Ahmed Tinubu,0.525,0.32499999999999996,positive
7,2022-12-17 00:39:55,after taking the bat and ball and going home he eventually decided to put his big boy pants on and bring them back thatll teach those journos for pointing out his hypocrisy,0,Bola Ahmed Tinubu,0.05,0.0,neutral
8,2022-12-17 00:39:54,alerts analysis and free trials join our server     conv ont axs tvk ogn atom eth icp lina insur bzrx mkr knc snx inj bat,0,Bola Ahmed Tinubu,0.8,0.4,positive
9,2022-12-17 00:39:54,i dont know how readily available it is outside of new zealand but if youre a fan of essie davis you should track down the justice of bunny king the movie a little messy but davis carries it through sheer force of will,0,Bola Ahmed Tinubu,0.4062049062049062,-0.0009559884559884562,negative
10,2022-12-17 00:39:52,ive spoken in favor of conforto as well but the yankees seem to be allin on run prevention of late not sure confortos limited defensive skill set will appeal to them when the bat is a question mark in its own right definite offensive upside though,0,Bola Ahmed Tinubu,0.6112433862433863,0.04404761904761904,positive
11,2022-12-17 00:39:50,clayton is having a party on  talk     bat,0,Bola Ahmed Tinubu,0.0,0.0,neutral
12,2022-12-17 00:39:49,dont take anything i say seriously unless im being serious,1,Bola Ahmed Tinubu,0.6666666666666666,-0.3333333333333333,negative
14,2022-12-17 00:39:48,the dingo fence in australia is longer than the distance between new york city to london,0,Bola Ahmed Tinubu,0.45454545454545453,0.13636363636363635,positive
15,2022-12-17 00:39:47,this foam looks like a bat,0,Bola Ahmed Tinubu,0.0,0.0,neutral
16,2022-12-17 00:39:47,for the th time he said he would quit drinking soda after this last coke,0,Bola Ahmed Tinubu,0.06666666666666667,0.0,neutral
17,2022-12-17 00:39:47,little red riding hood decided to wear orange today,0,Bola Ahmed Tinubu,0.25,-0.09375,negative
19,2022-12-17 00:39:46,bat ka nag sorry will be one of the most embarrassing things that will haunt me in the days to come,0,Bola Ahmed Tinubu,0.75,0.0,neutral
20,2022-12-17 00:39:46,a georgia teacher who bought a  travel insurance policy was rewarded  because she read the fine print of the contract,0,Bola Ahmed Tinubu,0.5,0.4166666666666667,positive
21,2022-12-17 00:39:42,absolutely crying over  adorable bat friend they made me,0,Bola Ahmed Tinubu,0.8,0.15,positive
22,2022-12-17 00:39:36,a song can make or ruin a persons day if they let it get to them,0,Bola Ahmed Tinubu,0.0,0.0,neutral
23,2022-12-17 00:39:35,for the th time he said he would quit drinking soda after this last coke,0,Bola Ahmed Tinubu,0.06666666666666667,0.0,neutral
26,2022-12-17 00:39:33,he had a hidden stash underneath the floorboards in the back room of the house,0,Bola Ahmed Tinubu,0.16666666666666666,-0.08333333333333333,negative
28,2022-12-17 00:39:32,i would like my life to be a statement of love and compassionand where it isnt that where my work lies,0,Bola Ahmed Tinubu,0.6,0.5,positive
31,2022-12-17 00:39:23,were supposed to be rivals spose to hate eachother yet here i lay awake staring at the ceiling questioning everything you do that you make me question reality life as we both know it,1,Bola Ahmed Tinubu,0.9,-0.8,negative
